A1: No | B1: XSL | C1: PROLOG | D1: (2) | E1: (3)
B2: xxsl.xsl | C2: psl.pl | D2: psl_2.pl | E2: psl_3.pl | F2: Prolog* | G2: DXSLT-Prolog* in %
A3: 1 | B3: 290 | C3: 326 | D3: 233 | F3: =MIN(C3,D3,E3) -> 233 | G3: =100-100*F3/B3 -> 19.65517241379311
A4: =$A3+1 -> 2 | B4: 110 | C4: 125 | D4: 106 | F4: =MIN(C4,D4,E4) -> 106 | G4: =100-100*F4/B4 -> 3.6363636363636402
A5: =$A4+1 -> 3 | B5: 522 | C5: 351 | F5: =MIN(C5,D5,E5) -> 351 | G5: =100-100*F5/B5 -> 32.758620689655174
A6: =$A5+1 -> 4 | B6: 331 | C6: 277 | D6: 245 | E6: 129 | F6: =MIN(C6,D6,E6) -> 129 | G6: =100-100*F6/B6 -> 61.027190332326285
A7: =$A6+1 -> 5 | B7: 522 | C7: 405 | F7: =MIN(C7,D7,E7) -> 405 | G7: =100-100*F7/B7 -> 22.41379310344827
A8: =$A7+1 -> 6 | B8: 543 | C8: 486 | F8: =MIN(C8,D8,E8) -> 486 | G8: =100-100*F8/B8 -> 10.497237569060772
A9: =$A8+1 -> 7 | B9: 323 | C9: 192 | F9: =MIN(C9,D9,E9) -> 192 | G9: =100-100*F9/B9 -> 40.557275541795669
A10: =$A9+1 -> 8 | B10: 394 | C10: 285 | F10: =MIN(C10,D10,E10) -> 285 | G10: =100-100*F10/B10 -> 27.664974619289339
A11: =$A10+1 -> 9 | B11: 1176 | C11: 926 | F11: =MIN(C11,D11,E11) -> 926 | G11: =100-100*F11/B11 -> 21.258503401360542
A12: =$A11+1 -> 10 | B12: 967 | C12: 781 | D12: 680 | F12: =MIN(C12,D12,E12) -> 680 | G12: =100-100*F12/B12 -> 29.679420889348506
A13: =$A12+1 -> 11
A14: =$A13+1 -> 12 | B14: 439 | C14: 352 | D14: 304 | F14: =MIN(C14,D14,E14) -> 304 | G14: =100-100*F14/B14 -> 30.751708428246019
A15: =$A14+1 -> 13 | B15: 437 | C15: 217 | F15: =MIN(C15,D15,E15) -> 217 | G15: =100-100*F15/B15 -> 50.34324942791762
A16: =$A15+1 -> 14 | B16: 266 | C16: 223 | D16: 516 | E16: 359 | F16: =MIN(C16,D16,E16) -> 223 | G16: =100-100*F16/B16 -> 16.165413533834581
A17: =$A16+1 -> 15 | B17: 969 | C17: 918 | D17: 903 | F17: =MIN(C17,D17,E17) -> 903 | G17: =100-100*F17/B17 -> 6.8111455108359138
A18: =$A17+1 -> 16 | B18: 2862
A19: =$A18+1 -> 17 | B19: 917 | C19: 664 | D19: 790 | F19: =MIN(C19,D19,E19) -> 664 | G19: =100-100*F19/B19 -> 27.589967284623768
A20: =$A19+1 -> 18 | B20: 657 | C20: 627 | F20: =MIN(C20,D20,E20) -> 627 | G20: =100-100*F20/B20 -> 4.5662100456621033
A21: =$A20+1 -> 19 | B21: 459 | C21: 270 | F21: =MIN(C21,D21,E21) -> 270 | G21: =100-100*F21/B21 -> 41.176470588235297
A22: =$A21+1 -> 20 | B22: 513 | C22: 286 | F22: =MIN(C22,D22,E22) -> 286 | G22: =100-100*F22/B22 -> 44.249512670565302
A23: =$A22+1 -> 21 | B23: 470 | C23: 355 | D23: 283 | F23: =MIN(C23,D23,E23) -> 283 | G23: =100-100*F23/B23 -> 39.787234042553195
A24: =$A23+1 -> 22 | B24: 323 | C24: 338 | F24: =MIN(C24,D24,E24) -> 338 | G24: =100-100*F24/B24 -> -4.6439628482972068
A25: =$A24+1 -> 23 | B25: 507 | C25: 289 | D25: 411 | F25: =MIN(C25,D25,E25) -> 289 | G25: =100-100*F25/B25 -> 42.998027613412226
A26: =$A25+1 -> 24 | B26: 563 | C26: 426 | D26: 445 | F26: =MIN(C26,D26,E26) -> 426 | G26: =100-100*F26/B26 -> 24.333925399644755
A27: =$A26+1 -> 25 | B27: 826 | C27: 276 | F27: =MIN(C27,D27,E27) -> 276 | G27: =100-100*F27/B27 -> 66.585956416464882
A28: =$A27+1 -> 26 | B28: 293 | C28: 387 | D28: 300 | E28: 326 | F28: =MIN(C28,D28,E28) -> 300 | G28: =100-100*F28/B28 -> -2.3890784982935145
A29: =$A28+1 -> 27 | B29: 699 | C29: 463 | D29: 617 | F29: =MIN(C29,D29,E29) -> 463 | G29: =100-100*F29/B29 -> 33.762517882689551
A30: =$A29+1 -> 28 | B30: 486 | C30: 387 | D30: 459 | F30: =MIN(C30,D30,E30) -> 387 | G30: =100-100*F30/B30 -> 20.370370370370367
A31: =$A30+1 -> 29 | B31: 611 | C31: 774 | F31: =MIN(C31,D31,E31) -> 774 | G31: =100-100*F31/B31 -> -26.677577741407532
A32: =$A31+1 -> 30 | B32: 471 | C32: 457 | D32: 286 | F32: =MIN(C32,D32,E32) -> 286 | G32: =100-100*F32/B32 -> 39.27813163481953
A33: =$A32+1 -> 31 | B33: 644 | C33: 722 | F33: =MIN(C33,D33,E33) -> 722 | G33: =100-100*F33/B33 -> -12.111801242236027
A34: =$A33+1 -> 32 | B34: 783 | C34: 607 | D34: 399 | F34: =MIN(C34,D34,E34) -> 399 | G34: =100-100*F34/B34 -> 49.042145593869733
A35: =$A34+1 -> 33 | B35: 1112 | C35: 632 | D35: 423 | F35: =MIN(C35,D35,E35) -> 423 | G35: =100-100*F35/B35 -> 61.960431654676256
A36: =$A35+1 -> 34 | B36: 1143 | C36: 368 | F36: =MIN(C36,D36,E36) -> 368 | G36: =100-100*F36/B36 -> 67.804024496937885
A37: =$A36+1 -> 35 | B37: 425 | C37: 249 | D37: 153 | F37: =MIN(C37,D37,E37) -> 153 | G37: =100-100*F37/B37 -> 64
A38: =$A37+1 -> 36 | B38: 981 | C38: 506 | F38: =MIN(C38,D38,E38) -> 506 | G38: =100-100*F38/B38 -> 48.419979612640162
A39: =$A38+1 -> 37 | B39: 621 | C39: 633 | D39: 427 | F39: =MIN(C39,D39,E39) -> 427 | G39: =100-100*F39/B39 -> 31.239935587761678
A40: =$A39+1 -> 38 | B40: 908 | C40: 855 | F40: =MIN(C40,D40,E40) -> 855 | G40: =100-100*F40/B40 -> 5.8370044052863506
A41: =$A40+1 -> 39 | B41: 585 | C41: 528 | F41: =MIN(C41,D41,E41) -> 528 | G41: =100-100*F41/B41 -> 9.7435897435897374
A42: =$A41+1 -> 40 | B42: 916 | C42: 723 | F42: =MIN(C42,D42,E42) -> 723 | G42: =100-100*F42/B42 -> 21.069868995633186
A43: =$A42+1 -> 41 | B43: 1188
A44: =$A43+1 -> 42 | B44: 299 | C44: 347 | D44: 343 | F44: =MIN(C44,D44,E44) -> 343 | G44: =100-100*F44/B44 -> -14.715719063545151
A45: =$A44+1 -> 43 | B45: 678 | C45: 428 | F45: =MIN(C45,D45,E45) -> 428 | G45: =100-100*F45/B45 -> 36.873156342182888
A46: =$A45+1 -> 44 | B46: 460 | C46: 482 | D46: 472 | F46: =MIN(C46,D46,E46) -> 472 | G46: =100-100*F46/B46 -> -2.6086956521739069
A47: =$A46+1 -> 45 | B47: 387 | C47: 336 | F47: =MIN(C47,D47,E47) -> 336 | G47: =100-100*F47/B47 -> 13.178294573643413
A48: =$A47+1 -> 46 | B48: 638 | C48: 445 | D48: 532 | F48: =MIN(C48,D48,E48) -> 445 | G48: =100-100*F48/B48 -> 30.250783699059568
A49: =$A48+1 -> 47 | B49: 1188 | C49: 903 | F49: =MIN(C49,D49,E49) -> 903 | G49: =100-100*F49/B49 -> 23.98989898989899
A50: =$A49+1 -> 48 | B50: 300 | C50: 324 | F50: =MIN(C50,D50,E50) -> 324 | G50: =100-100*F50/B50 -> -8
A51: =$A50+1 -> 49 | B51: 941 | C51: 1078 | F51: =MIN(C51,D51,E51) -> 1078 | G51: =100-100*F51/B51 -> -14.558979808714128
A52: =$A51+1 -> 50 | B52: 1403 | C52: 1071 | F52: =MIN(C52,D52,E52) -> 1071 | G52: =100-100*F52/B52 -> 23.663578047042051
A53: =$A52+1 -> 51 | B53: 812 | C53: 745 | F53: =MIN(C53,D53,E53) -> 745 | G53: =100-100*F53/B53 -> 8.2512315270935943
A54: =$A53+1 -> 52 | B54: 569 | C54: 463 | F54: =MIN(C54,D54,E54) -> 463 | G54: =100-100*F54/B54 -> 18.629173989455182
A55: =$A54+1 -> 53 | B55: 864 | C55: 813 | F55: =MIN(C55,D55,E55) -> 813 | G55: =100-100*F55/B55 -> 5.9027777777777715
A56: =$A55+1 -> 54 | B56: 784 | C56: 939 | D56: 885 | F56: =MIN(C56,D56,E56) -> 885 | G56: =100-100*F56/B56 -> -12.882653061224488
A57: =$A56+1 -> 55 | B57: 366 | C57: 438 | F57: =MIN(C57,D57,E57) -> 438 | G57: =100-100*F57/B57 -> -19.672131147540981
A58: =$A57+1 -> 56 | B58: 871 | C58: 1797 | F58: =MIN(C58,D58,E58) -> 1797 | G58: =100-100*F58/B58 -> -106.31458094144662
A59: =$A58+1 -> 57 | B59: 691
A60: =$A59+1 -> 58 | B60: 222
A61: =$A60+1 -> 59 | B61: 195
A62: =$A61+1 -> 60 | B62: 224
A63: =$A62+1 -> 61 | B63: 241
A64: =$A63+1 -> 62 | B64: 543
A65: =$A64+1 -> 63 | B65: 563 | C65: 428 | D65: 376 | F65: =MIN(C65,D65,E65) -> 376 | G65: =100-100*F65/B65 -> 33.214920071047956
A66: =$A65+1 -> 64 | B66: 826 | C66: 341 | D66: 384 | E66: 276 | F66: =MIN(C66,D66,E66) -> 276 | G66: =100-100*F66/B66 -> 66.585956416464882
A67: =$A66+1 -> 65 | B67: 818 | C67: 878 | D67: 810 | F67: =MIN(C67,D67,E67) -> 810 | G67: =100-100*F67/B67 -> 0.97799511002445172
A68: =$A67+1 -> 66 | B68: 1044
A69: =$A68+1 -> 67 | B69: 236
A70: =$A69+1 -> 68 | B70: 236
A71: =$A70+1 -> 69 | B71: 314
A72: =$A71+1 -> 70 | B72: 244
A73: =$A72+1 -> 71 | B73: 457
A74: 7_2 | B74: 1205 | C74: 559 | F74: =MIN(C74,D74,E74) -> 559 | G74: =100-100*F74/B74 -> 53.609958506224068