A1: Holstead-metrics
E2: I | I2: II | M2: III | P2: IV | S2: V
A3: № | C3: LOC | D3: h1 | E3: h2 | F3: N1 | G3: N2 | H3: N1/N2 | I3: NT | J3: (NEx) | K3: |DN| % | L3: V | M3: L~ | N3: L | O3: S | P3: I | Q3: l | R3: E | S3: T | T3: B
A4: 1 | B4: Prolog | C4: 13 | D4: 14 | E4: 20 | F4: 62 | G4: 36 | H4: =$F4/$G4 -> 1.7222222222222223 | I4: =$D4*(LOG10($D4)/LOG10(2))+$E4*(LOG10($E4)/LOG10(2)) -> 139.7415308065537 | J4: =$F4+$G4 -> 98 | K4: =ROUND(100*(MAX(ROUNDUP($I4,0),$J4)-MIN(ROUNDUP($I4,0),$J4))/MAX(ROUNDUP($I4,0),$J4),0) -> 30 | L4: =($F4+$G4)*LOG10($D4+$E4)/LOG10(2) -> 498.57135844253332 | M4: =2*$E4/($D4*$G4) -> 7.9365079365079361E-2 | N4: =8/$L4 -> 1.6045847529210008E-2 | O4: =1/$N4 -> 62.321419805316665 | P4: =$M4*$L4 -> 39.569155431947088 | Q4: =8*$N4 -> 0.12836678023368006 | R4: =ROUNDUP($L4/$N4,0) -> 31072 | S4: =$R4/$O4 -> 498.57657442761331 | T4: =$L4/300 -> 1.6619045281417777 | U4: =L4/(F4+G4) -> 5.08746284125034
B5: Prolog2 | C5: 9 | D5: 14 | E5: 17 | F5: 50 | G5: 28 | H5: =$F5/$G5 -> 1.7857142857142858 | I5: =$D5*(LOG10($D5)/LOG10(2))+$E5*(LOG10($E5)/LOG10(2)) -> 122.78983721006222 | J5: =$F5+$G5 -> 78 | K5: =ROUND(100*(MAX(ROUNDUP($I5,0),$J5)-MIN(ROUNDUP($I5,0),$J5))/MAX(ROUNDUP($I5,0),$J5),0) -> 37 | L5: =($F5+$G5)*LOG10($D5+$E5)/LOG10(2) -> 386.42731221017624 | M5: =2*$E5/($D5*$G5) -> 8.673469387755102E-2 | N5: =8/$L5 -> 2.070247041867691E-2 | O5: =1/$N5 -> 48.30341402627203 | P5: =$M5*$L5 -> 33.51665463047447 | Q5: =8*$N5 -> 0.16561976334941528 | R5: =ROUNDUP($L5/$N5,0) -> 18666 | S5: =$R5/$O5 -> 386.4323128350232 | T5: =$L5/300 -> 1.2880910407005874 | U5: =L5/(F5+G5) -> 4.9541963103868749
B6: XSLT | C6: 10 | D6: 5 | E6: 5 | F6: 6 | G6: 5 | H6: =$F6/$G6 -> 1.2 | I6: =$D6*(LOG10($D6)/LOG10(2))+$E6*(LOG10($E6)/LOG10(2)) -> 23.219280948873624 | J6: =$F6+$G6 -> 11 | K6: =ROUND(100*(MAX(ROUNDUP($I6,0),$J6)-MIN(ROUNDUP($I6,0),$J6))/MAX(ROUNDUP($I6,0),$J6),0) -> 54 | L6: =($F6+$G6)*LOG10($D6+$E6)/LOG10(2) -> 36.541209043760986 | M6: =2*$E6/($D6*$G6) -> 0.4 | N6: =8/$L6 -> 0.21893090593744086 | O6: =1/$N6 -> 4.5676511304701233 | P6: =$M6*$L6 -> 14.616483617504395 | Q6: =8*$N6 -> 1.7514472474995268 | R6: =ROUNDUP($L6/$N6,0) -> 167 | S6: =$R6/$O6 -> 36.561461291552625 | T6: =$L6/300 -> 0.12180403014586995 | U6: =L6/(F6+G6) -> 3.3219280948873622
B7: XSLT2 | C7: 10 | D7: 5 | E7: 12 | F7: 29 | G7: 23 | H7: =$F7/$G7 -> 1.2608695652173914 | I7: =$D7*(LOG10($D7)/LOG10(2))+$E7*(LOG10($E7)/LOG10(2)) -> 54.629190483090696 | J7: =$F7+$G7 -> 52 | K7: =ROUND(100*(MAX(ROUNDUP($I7,0),$J7)-MIN(ROUNDUP($I7,0),$J7))/MAX(ROUNDUP($I7,0),$J7),0) -> 5 | L7: =($F7+$G7)*LOG10($D7+$E7)/LOG10(2) -> 212.54806774501762 | M7: =2*$E7/($D7*$G7) -> 0.20869565217391303 | N7: =8/$L7 -> 3.7638544941265548E-2 | O7: =1/$N7 -> 26.568508468127202 | P7: =$M7*$L7 -> 44.357857616351502 | Q7: =8*$N7 -> 0.30110835953012438 | R7: =ROUNDUP($L7/$N7,0) -> 5648 | S7: =$R7/$O7 -> 212.58250182826782 | T7: =$L7/300 -> 0.70849355915005874 | U7: =L7/(F7+G7) -> 4.0874628412503391
A8: 2 | B8: Prolog | C8: 7 | D8: 12 | E8: 10 | F8: 29 | G8: 15 | H8: =$F8/$G8 -> 1.9333333333333333 | I8: =$D8*(LOG10($D8)/LOG10(2))+$E8*(LOG10($E8)/LOG10(2)) -> 76.238830957527512 | J8: =$F8+$G8 -> 44 | K8: =ROUND(100*(MAX(ROUNDUP($I8,0),$J8)-MIN(ROUNDUP($I8,0),$J8))/MAX(ROUNDUP($I8,0),$J8),0) -> 43 | L8: =($F8+$G8)*LOG10($D8+$E8)/LOG10(2) -> 196.21499122004107 | M8: =2*$E8/($D8*$G8) -> 0.1111111111111111 | N8: =8/$L8 -> 4.0771604403195535E-2 | O8: =1/$N8 -> 24.526873902505134 | P8: =$M8*$L8 -> 21.801665691115673 | Q8: =8*$N8 -> 0.32617283522556428 | R8: =ROUNDUP($L8/$N8,0) -> 4813 | S8: =$R8/$O8 -> 196.23373199258012 | T8: =$L8/300 -> 0.65404997073347027 | U8: =L8/(F8+G8) -> 4.4594316186372973
B9: Prolog2 | C9: 7 | D9: 11 | E9: 10 | F9: 24 | G9: 13 | H9: =$F9/$G9 -> 1.8461538461538463 | I9: =$D9*(LOG10($D9)/LOG10(2))+$E9*(LOG10($E9)/LOG10(2)) -> 71.273028753883892 | J9: =$F9+$G9 -> 37 | K9: =ROUND(100*(MAX(ROUNDUP($I9,0),$J9)-MIN(ROUNDUP($I9,0),$J9))/MAX(ROUNDUP($I9,0),$J9),0) -> 49 | L9: =($F9+$G9)*LOG10($D9+$E9)/LOG10(2) -> 162.51574464281413 | M9: =2*$E9/($D9*$G9) -> 0.13986013986013987 | N9: =8/$L9 -> 4.9225999718260111E-2 | O9: =1/$N9 -> 20.314468080351766 | P9: =$M9*$L9 -> 22.729474775218762 | Q9: =8*$N9 -> 0.39380799774608088 | R9: =ROUNDUP($L9/$N9,0) -> 3302 | S9: =$R9/$O9 -> 162.54425106969487 | T9: =$L9/300 -> 0.54171914880938044 | U9: =L9/(F9+G9) -> 4.3923174227787598
B10: XSLT | C10: 3 | D10: 1 | E10: 2 | F10: 1 | G10: 2 | H10: =$F10/$G10 -> 0.5 | I10: =$D10*(LOG10($D10)/LOG10(2))+$E10*(LOG10($E10)/LOG10(2)) -> 2 | J10: =$F10+$G10 -> 3 | K10: =ROUND(100*(MAX(ROUNDUP($I10,0),$J10)-MIN(ROUNDUP($I10,0),$J10))/MAX(ROUNDUP($I10,0),$J10),0) -> 33 | L10: =($F10+$G10)*LOG10($D10+$E10)/LOG10(2) -> 4.7548875021634682 | M10: =2*$E10/($D10*$G10) -> 2 | N10: =8/$L10 -> 1.68247934285722 | O10: =1/$N10 -> 0.59436093777043353 | P10: =$M10*$L10 -> 9.5097750043269365 | Q10: =8*$N10 -> 13.45983474285776 | R10: =ROUNDUP($L10/$N10,0) -> 3 | S10: =$R10/$O10 -> 5.0474380285716602 | T10: =$L10/300 -> 1.584962500721156E-2 | U10: =L10/(F10+G10) -> 1.5849625007211561
B11: XSLT2 | C11: 3 | D11: 4 | E11: 6 | F11: 8 | G11: 9 | H11: =$F11/$G11 -> 0.88888888888888884 | I11: =$D11*(LOG10($D11)/LOG10(2))+$E11*(LOG10($E11)/LOG10(2)) -> 23.509775004326936 | J11: =$F11+$G11 -> 17 | K11: =ROUND(100*(MAX(ROUNDUP($I11,0),$J11)-MIN(ROUNDUP($I11,0),$J11))/MAX(ROUNDUP($I11,0),$J11),0) -> 29 | L11: =($F11+$G11)*LOG10($D11+$E11)/LOG10(2) -> 56.472777613085157 | M11: =2*$E11/($D11*$G11) -> 0.33333333333333331 | N11: =8/$L11 -> 0.14166117443010881 | O11: =1/$N11 -> 7.0590972016356446 | P11: =$M11*$L11 -> 18.824259204361717 | Q11: =8*$N11 -> 1.1332893954408705 | R11: =ROUNDUP($L11/$N11,0) -> 399 | S11: =$R11/$O11 -> 56.522808597613412 | T11: =$L11/300 -> 0.18824259204361718 | U11: =L11/(F11+G11) -> 3.3219280948873622
A12: 3 | B12: Prolog | C12: 16 | D12: 11 | E12: 21 | F12: 81 | G12: 40 | H12: =$F12/$G12 -> 2.0249999999999999 | I12: =$D12*(LOG10($D12)/LOG10(2))+$E12*(LOG10($E12)/LOG10(2)) -> 130.29241368336426 | J12: =$F12+$G12 -> 121 | K12: =ROUND(100*(MAX(ROUNDUP($I12,0),$J12)-MIN(ROUNDUP($I12,0),$J12))/MAX(ROUNDUP($I12,0),$J12),0) -> 8 | L12: =($F12+$G12)*LOG10($D12+$E12)/LOG10(2) -> 605 | M12: =2*$E12/($D12*$G12) -> 9.5454545454545459E-2 | N12: =8/$L12 -> 1.3223140495867768E-2 | O12: =1/$N12 -> 75.625 | P12: =$M12*$L12 -> 57.75 | Q12: =8*$N12 -> 0.10578512396694215 | R12: =ROUNDUP($L12/$N12,0) -> 45754 | S12: =$R12/$O12 -> 605.01157024793383 | T12: =$L12/300 -> 2.0166666666666666 | U12: =L12/(F12+G12) -> 5
B13: XSLT | C13: 21 | D13: 6 | E13: 7 | F13: 12 | G13: 9 | H13: =$F13/$G13 -> 1.3333333333333333 | I13: =$D13*(LOG10($D13)/LOG10(2))+$E13*(LOG10($E13)/LOG10(2)) -> 35.161259458730164 | J13: =$F13+$G13 -> 21 | K13: =ROUND(100*(MAX(ROUNDUP($I13,0),$J13)-MIN(ROUNDUP($I13,0),$J13))/MAX(ROUNDUP($I13,0),$J13),0) -> 42 | L13: =($F13+$G13)*LOG10($D13+$E13)/LOG10(2) -> 77.709234080962929 | M13: =2*$E13/($D13*$G13) -> 0.25925925925925924 | N13: =8/$L13 -> 0.10294786835326467 | O13: =1/$N13 -> 9.7136542601203661 | P13: =$M13*$L13 -> 20.146838465434833 | Q13: =8*$N13 -> 0.82358294682611732 | R13: =ROUNDUP($L13/$N13,0) -> 755 | S13: =$R13/$O13 -> 77.725640606714833 | T13: =$L13/300 -> 0.25903078026987642 | U13: =L13/(F13+G13) -> 3.7004397181410917
B14: XSLT2 | C14: 21 | D14: 5 | E14: 18 | F14: 57 | G14: 49 | H14: =$F14/$G14 -> 1.1632653061224489 | I14: =$D14*(LOG10($D14)/LOG10(2))+$E14*(LOG10($E14)/LOG10(2)) -> 86.668290500398427 | J14: =$F14+$G14 -> 106 | K14: =ROUND(100*(MAX(ROUNDUP($I14,0),$J14)-MIN(ROUNDUP($I14,0),$J14))/MAX(ROUNDUP($I14,0),$J14),0) -> 18 | L14: =($F14+$G14)*LOG10($D14+$E14)/LOG10(2) -> 479.49756734204334 | M14: =2*$E14/($D14*$G14) -> 0.14693877551020409 | N14: =8/$L14 -> 1.6684130525094622E-2 | O14: =1/$N14 -> 59.937195917755417 | P14: =$M14*$L14 -> 70.456785405361472 | Q14: =8*$N14 -> 0.13347304420075698 | R14: =ROUNDUP($L14/$N14,0) -> 28740 | S14: =$R14/$O14 -> 479.50191129121947 | T14: =$L14/300 -> 1.5983252244734778 | U14: =L14/(F14+G14) -> 4.5235619560570131
A15: 4 | B15: Prolog | C15: 10 | D15: 13 | E15: 17 | F15: 58 | G15: 29 | H15: =$F15/$G15 -> 2 | I15: =$D15*(LOG10($D15)/LOG10(2))+$E15*(LOG10($E15)/LOG10(2)) -> 117.59258463708997 | J15: =$F15+$G15 -> 87 | K15: =ROUND(100*(MAX(ROUNDUP($I15,0),$J15)-MIN(ROUNDUP($I15,0),$J15))/MAX(ROUNDUP($I15,0),$J15),0) -> 26 | L15: =($F15+$G15)*LOG10($D15+$E15)/LOG10(2) -> 426.89948181794108 | M15: =2*$E15/($D15*$G15) -> 9.0185676392572939E-2 | N15: =8/$L15 -> 1.873977444510402E-2 | O15: =1/$N15 -> 53.362435227242628 | P15: =$M15*$L15 -> 38.500218519389911 | Q15: =8*$N15 -> 0.14991819556083216 | R15: =ROUNDUP($L15/$N15,0) -> 22781 | S15: =$R15/$O15 -> 426.91080163391473 | T15: =$L15/300 -> 1.4229982727264703 | U15: =L15/(F15+G15) -> 4.9068905956085178
B16: Prolog2 | C16: 8 | D16: 11 | E16: 16 | F16: 48 | G16: 25 | H16: =$F16/$G16 -> 1.92 | I16: =$D16*(LOG10($D16)/LOG10(2))+$E16*(LOG10($E16)/LOG10(2)) -> 102.05374780501027 | J16: =$F16+$G16 -> 73 | K16: =ROUND(100*(MAX(ROUNDUP($I16,0),$J16)-MIN(ROUNDUP($I16,0),$J16))/MAX(ROUNDUP($I16,0),$J16),0) -> 29 | L16: =($F16+$G16)*LOG10($D16+$E16)/LOG10(2) -> 347.10678765793324 | M16: =2*$E16/($D16*$G16) -> 0.11636363636363636 | N16: =8/$L16 -> 2.3047662230920817E-2 | O16: =1/$N16 -> 43.388348457241655 | P16: =$M16*$L16 -> 40.390608018377684 | Q16: =8*$N16 -> 0.18438129784736654 | R16: =ROUNDUP($L16/$N16,0) -> 15061 | S16: =$R16/$O16 -> 347.12084085989841 | T16: =$L16/300 -> 1.1570226255264442 | U16: =L16/(F16+G16) -> 4.7548875021634691
B17: Prolog3 | C17: 7 | D17: 12 | E17: 12 | F17: 28 | G17: 16 | H17: =$F17/$G17 -> 1.75 | I17: =$D17*(LOG10($D17)/LOG10(2))+$E17*(LOG10($E17)/LOG10(2)) -> 86.03910001730776 | J17: =$F17+$G17 -> 44 | K17: =ROUND(100*(MAX(ROUNDUP($I17,0),$J17)-MIN(ROUNDUP($I17,0),$J17))/MAX(ROUNDUP($I17,0),$J17),0) -> 49 | L17: =($F17+$G17)*LOG10($D17+$E17)/LOG10(2) -> 201.73835003173085 | M17: =2*$E17/($D17*$G17) -> 0.125 | N17: =8/$L17 -> 3.9655325815551194E-2 | O17: =1/$N17 -> 25.217293753966359 | P17: =$M17*$L17 -> 25.217293753966356 | Q17: =8*$N17 -> 0.31724260652440955 | R17: =ROUNDUP($L17/$N17,0) -> 5088 | S17: =$R17/$O17 -> 201.76629774952445 | T17: =$L17/300 -> 0.67246116677243617 | U17: =L17/(F17+G17) -> 4.5849625007211552
B18: XSLT | C18: 13 | D18: 5 | E18: 5 | F18: 7 | G18: 6 | H18: =$F18/$G18 -> 1.1666666666666667 | I18: =$D18*(LOG10($D18)/LOG10(2))+$E18*(LOG10($E18)/LOG10(2)) -> 23.219280948873624 | J18: =$F18+$G18 -> 13 | K18: =ROUND(100*(MAX(ROUNDUP($I18,0),$J18)-MIN(ROUNDUP($I18,0),$J18))/MAX(ROUNDUP($I18,0),$J18),0) -> 46 | L18: =($F18+$G18)*LOG10($D18+$E18)/LOG10(2) -> 43.18506523353571 | M18: =2*$E18/($D18*$G18) -> 0.33333333333333331 | N18: =8/$L18 -> 0.18524922810091152 | O18: =1/$N18 -> 5.3981331541919637 | P18: =$M18*$L18 -> 14.395021744511903 | Q18: =8*$N18 -> 1.4819938248072921 | R18: =ROUNDUP($L18/$N18,0) -> 234 | S18: =$R18/$O18 -> 43.348319375613293 | T18: =$L18/300 -> 0.14395021744511904 | U18: =L18/(F18+G18) -> 3.3219280948873622
B19: XSLT2 | C19: 13 | D19: 5 | E19: 15 | F19: 36 | G19: 31 | H19: =$F19/$G19 -> 1.1612903225806452 | I19: =$D19*(LOG10($D19)/LOG10(2))+$E19*(LOG10($E19)/LOG10(2)) -> 70.212999408564599 | J19: =$F19+$G19 -> 67 | K19: =ROUND(100*(MAX(ROUNDUP($I19,0),$J19)-MIN(ROUNDUP($I19,0),$J19))/MAX(ROUNDUP($I19,0),$J19),0) -> 6 | L19: =($F19+$G19)*LOG10($D19+$E19)/LOG10(2) -> 289.56918235745331 | M19: =2*$E19/($D19*$G19) -> 0.19354838709677419 | N19: =8/$L19 -> 2.7627249332508555E-2 | O19: =1/$N19 -> 36.196147794681664 | P19: =$M19*$L19 -> 56.045648198216767 | Q19: =8*$N19 -> 0.22101799466006844 | R19: =ROUNDUP($L19/$N19,0) -> 10482 | S19: =$R19/$O19 -> 289.58882750335465 | T19: =$L19/300 -> 0.96523060785817771 | U19: =L19/(F19+G19) -> 4.3219280948873626
A20: 5 | B20: Prolog | C20: 15 | D20: 15 | E20: 23 | F20: 80 | G20: 48 | H20: =$F20/$G20 -> 1.6666666666666667 | I20: =$D20*(LOG10($D20)/LOG10(2))+$E20*(LOG10($E20)/LOG10(2)) -> 162.64528392343908 | J20: =$F20+$G20 -> 128 | K20: =ROUND(100*(MAX(ROUNDUP($I20,0),$J20)-MIN(ROUNDUP($I20,0),$J20))/MAX(ROUNDUP($I20,0),$J20),0) -> 21 | L20: =($F20+$G20)*LOG10($D20+$E20)/LOG10(2) -> 671.73472172077891 | M20: =2*$E20/($D20*$G20) -> 6.3888888888888884E-2 | N20: =8/$L20 -> 1.1909463276673337E-2 | O20: =1/$N20 -> 83.966840215097363 | P20: =$M20*$L20 -> 42.916384998827539 | Q20: =8*$N20 -> 9.5275706213386699E-2 | R20: =ROUNDUP($L20/$N20,0) -> 56404 | S20: =$R20/$O20 -> 671.7413666574829 | T20: =$L20/300 -> 2.2391157390692631 | U20: =L20/(F20+G20) -> 5.2479275134435852
B21: XSLT | C21: 22 | D21: 6 | E21: 7 | F21: 12 | G21: 9 | H21: =$F21/$G21 -> 1.3333333333333333 | I21: =$D21*(LOG10($D21)/LOG10(2))+$E21*(LOG10($E21)/LOG10(2)) -> 35.161259458730164 | J21: =$F21+$G21 -> 21 | K21: =ROUND(100*(MAX(ROUNDUP($I21,0),$J21)-MIN(ROUNDUP($I21,0),$J21))/MAX(ROUNDUP($I21,0),$J21),0) -> 42 | L21: =($F21+$G21)*LOG10($D21+$E21)/LOG10(2) -> 77.709234080962929 | M21: =2*$E21/($D21*$G21) -> 0.25925925925925924 | N21: =8/$L21 -> 0.10294786835326467 | O21: =1/$N21 -> 9.7136542601203661 | P21: =$M21*$L21 -> 20.146838465434833 | Q21: =8*$N21 -> 0.82358294682611732 | R21: =ROUNDUP($L21/$N21,0) -> 755 | S21: =$R21/$O21 -> 77.725640606714833 | T21: =$L21/300 -> 0.25903078026987642 | U21: =L21/(F21+G21) -> 3.7004397181410917
B22: XSLT2 | C22: 22 | D22: 5 | E22: 18 | F22: 57 | G22: 48 | H22: =$F22/$G22 -> 1.1875 | I22: =$D22*(LOG10($D22)/LOG10(2))+$E22*(LOG10($E22)/LOG10(2)) -> 86.668290500398427 | J22: =$F22+$G22 -> 105 | K22: =ROUND(100*(MAX(ROUNDUP($I22,0),$J22)-MIN(ROUNDUP($I22,0),$J22))/MAX(ROUNDUP($I22,0),$J22),0) -> 17 | L22: =($F22+$G22)*LOG10($D22+$E22)/LOG10(2) -> 474.97400538598635 | M22: =2*$E22/($D22*$G22) -> 0.15 | N22: =8/$L22 -> 1.6843027006285999E-2 | O22: =1/$N22 -> 59.371750673248293 | P22: =$M22*$L22 -> 71.246100807897946 | Q22: =8*$N22 -> 0.134744216050288 | R22: =ROUNDUP($L22/$N22,0) -> 28201 | S22: =$R22/$O22 -> 474.99020460427147 | T22: =$L22/300 -> 1.5832466846199544 | U22: =L22/(F22+G22) -> 4.5235619560570131
A23: 6 | B23: Prolog | C23: 17 | D23: 16 | E23: 24 | F23: 82 | G23: 45 | H23: =$F23/$G23 -> 1.8222222222222222 | I23: =$D23*(LOG10($D23)/LOG10(2))+$E23*(LOG10($E23)/LOG10(2)) -> 174.03910001730776 | J23: =$F23+$G23 -> 127 | K23: =ROUND(100*(MAX(ROUNDUP($I23,0),$J23)-MIN(ROUNDUP($I23,0),$J23))/MAX(ROUNDUP($I23,0),$J23),0) -> 27 | L23: =($F23+$G23)*LOG10($D23+$E23)/LOG10(2) -> 675.88486805069499 | M23: =2*$E23/($D23*$G23) -> 6.6666666666666666E-2 | N23: =8/$L23 -> 1.1836335414746935E-2 | O23: =1/$N23 -> 84.485608506336874 | P23: =$M23*$L23 -> 45.058991203379662 | Q23: =8*$N23 -> 9.4690683317975477E-2 | R23: =ROUNDUP($L23/$N23,0) -> 57103 | S23: =$R23/$O23 -> 675.89026118829418 | T23: =$L23/300 -> 2.2529495601689833 | U23: =L23/(F23+G23) -> 5.3219280948873617
B24: XSLT | C24: 17 | D24: 6 | E24: 9 | F24: 11 | G24: 12 | H24: =$F24/$G24 -> 0.91666666666666663 | I24: =$D24*(LOG10($D24)/LOG10(2))+$E24*(LOG10($E24)/LOG10(2)) -> 44.039100017307746 | J24: =$F24+$G24 -> 23 | K24: =ROUND(100*(MAX(ROUNDUP($I24,0),$J24)-MIN(ROUNDUP($I24,0),$J24))/MAX(ROUNDUP($I24,0),$J24),0) -> 49 | L24: =($F24+$G24)*LOG10($D24+$E24)/LOG10(2) -> 89.85848369899594 | M24: =2*$E24/($D24*$G24) -> 0.25 | N24: =8/$L24 -> 8.9028878194718414E-2 | O24: =1/$N24 -> 11.232310462374492 | P24: =$M24*$L24 -> 22.464620924748985 | Q24: =8*$N24 -> 0.71223102555774731 | R24: =ROUNDUP($L24/$N24,0) -> 1010 | S24: =$R24/$O24 -> 89.919166976665608 | T24: =$L24/300 -> 0.29952827899665313 | U24: =L24/(F24+G24) -> 3.9068905956085191
B25: XSLT2 | C25: 17 | D25: 6 | E25: 23 | F25: 60 | G25: 56 | H25: =$F25/$G25 -> 1.0714285714285714 | I25: =$D25*(LOG10($D25)/LOG10(2))+$E25*(LOG10($E25)/LOG10(2)) -> 119.55169999363824 | J25: =$F25+$G25 -> 116 | K25: =ROUND(100*(MAX(ROUNDUP($I25,0),$J25)-MIN(ROUNDUP($I25,0),$J25))/MAX(ROUNDUP($I25,0),$J25),0) -> 3 | L25: =($F25+$G25)*LOG10($D25+$E25)/LOG10(2) -> 563.5257954347984 | M25: =2*$E25/($D25*$G25) -> 0.13690476190476192 | N25: =8/$L25 -> 1.419633327313341E-2 | O25: =1/$N25 -> 70.4407244293498 | P25: =$M25*$L25 -> 77.149364851192644 | Q25: =8*$N25 -> 0.11357066618506728 | R25: =ROUNDUP($L25/$N25,0) -> 39696 | S25: =$R25/$O25 -> 563.5376456103038 | T25: =$L25/300 -> 1.8784193181159947 | U25: =L25/(F25+G25) -> 4.8579809951275728
A26: 7 | B26: Prolog | C26: 8 | D26: 14 | E26: 14 | F26: 40 | G26: 21 | H26: =$F26/$G26 -> 1.9047619047619047 | I26: =$D26*(LOG10($D26)/LOG10(2))+$E26*(LOG10($E26)/LOG10(2)) -> 106.6059378176129 | J26: =$F26+$G26 -> 61 | K26: =ROUND(100*(MAX(ROUNDUP($I26,0),$J26)-MIN(ROUNDUP($I26,0),$J26))/MAX(ROUNDUP($I26,0),$J26),0) -> 43 | L26: =($F26+$G26)*LOG10($D26+$E26)/LOG10(2) -> 293.24865024551389 | M26: =2*$E26/($D26*$G26) -> 9.5238095238095233E-2 | N26: =8/$L26 -> 2.7280602973968449E-2 | O26: =1/$N26 -> 36.656081280689236 | P26: =$M26*$L26 -> 27.928442880525129 | Q26: =8*$N26 -> 0.21824482379174759 | R26: =ROUNDUP($L26/$N26,0) -> 10750 | S26: =$R26/$O26 -> 293.26648197016084 | T26: =$L26/300 -> 0.97749550081837966 | U26: =L26/(F26+G26) -> 4.8073549220576046
B27: XSLT | C27: 10 | D27: 5 | E27: 7 | F27: 6 | G27: 7 | H27: =$F27/$G27 -> 0.8571428571428571 | I27: =$D27*(LOG10($D27)/LOG10(2))+$E27*(LOG10($E27)/LOG10(2)) -> 31.26112492884004 | J27: =$F27+$G27 -> 13 | K27: =ROUND(100*(MAX(ROUNDUP($I27,0),$J27)-MIN(ROUNDUP($I27,0),$J27))/MAX(ROUNDUP($I27,0),$J27),0) -> 59 | L27: =($F27+$G27)*LOG10($D27+$E27)/LOG10(2) -> 46.604512509375027 | M27: =2*$E27/($D27*$G27) -> 0.4 | N27: =8/$L27 -> 0.17165719732377221 | O27: =1/$N27 -> 5.8255640636718784 | P27: =$M27*$L27 -> 18.641805003750012 | Q27: =8*$N27 -> 1.3732575785901777 | R27: =ROUNDUP($L27/$N27,0) -> 272 | S27: =$R27/$O27 -> 46.690757672066042 | T27: =$L27/300 -> 0.1553483750312501 | U27: =L27/(F27+G27) -> 3.5849625007211561
B28: XSLT2 | C28: 10 | D28: 6 | E28: 18 | F28: 34 | G28: 32 | H28: =$F28/$G28 -> 1.0625 | I28: =$D28*(LOG10($D28)/LOG10(2))+$E28*(LOG10($E28)/LOG10(2)) -> 90.568425030288552 | J28: =$F28+$G28 -> 66 | K28: =ROUND(100*(MAX(ROUNDUP($I28,0),$J28)-MIN(ROUNDUP($I28,0),$J28))/MAX(ROUNDUP($I28,0),$J28),0) -> 27 | L28: =($F28+$G28)*LOG10($D28+$E28)/LOG10(2) -> 302.60752504759631 | M28: =2*$E28/($D28*$G28) -> 0.1875 | N28: =8/$L28 -> 2.6436883877034127E-2 | O28: =1/$N28 -> 37.825940630949539 | P28: =$M28*$L28 -> 56.738910946424312 | Q28: =8*$N28 -> 0.21149507101627302 | R28: =ROUNDUP($L28/$N28,0) -> 11447 | S28: =$R28/$O28 -> 302.62300974040966 | T28: =$L28/300 -> 1.0086917501586543 | U28: =L28/(F28+G28) -> 4.5849625007211561
A29: 7_2 | B29: Prolog | C29: 13 | D29: 14 | E29: 23 | F29: 116 | G29: 57 | H29: =$F29/$G29 -> 2.0350877192982457 | I29: =$D29*(LOG10($D29)/LOG10(2))+$E29*(LOG10($E29)/LOG10(2)) -> 157.34489389811773 | J29: =$F29+$G29 -> 173 | K29: =ROUND(100*(MAX(ROUNDUP($I29,0),$J29)-MIN(ROUNDUP($I29,0),$J29))/MAX(ROUNDUP($I29,0),$J29),0) -> 9 | L29: =($F29+$G29)*LOG10($D29+$E29)/LOG10(2) -> 901.2354322538082 | M29: =2*$E29/($D29*$G29) -> 5.764411027568922E-2 | N29: =8/$L29 -> 8.8767038153322632E-3 | O29: =1/$N29 -> 112.65442903172601 | P29: =$M29*$L29 -> 51.95091464119696 | Q29: =8*$N29 -> 7.1013630522658105E-2 | R29: =ROUNDUP($L29/$N29,0) -> 101529 | S29: =$R29/$O29 -> 901.24286166686943 | T29: =$L29/300 -> 3.0041181075126939 | U29: =L29/(F29+G29) -> 5.2094533656289492
B30: XSLT | C30: 40 | D30: 6 | E30: 15 | F30: 28 | G30: 24 | H30: =$F30/$G30 -> 1.1666666666666667 | I30: =$D30*(LOG10($D30)/LOG10(2))+$E30*(LOG10($E30)/LOG10(2)) -> 74.113133938454723 | J30: =$F30+$G30 -> 52 | K30: =ROUND(100*(MAX(ROUNDUP($I30,0),$J30)-MIN(ROUNDUP($I30,0),$J30))/MAX(ROUNDUP($I30,0),$J30),0) -> 31 | L30: =($F30+$G30)*LOG10($D30+$E30)/LOG10(2) -> 228.40050598449554 | M30: =2*$E30/($D30*$G30) -> 0.20833333333333334 | N30: =8/$L30 -> 3.502619210722354E-2 | O30: =1/$N30 -> 28.550063248061939 | P30: =$M30*$L30 -> 47.583438746769907 | Q30: =8*$N30 -> 0.28020953685778832 | R30: =ROUNDUP($L30/$N30,0) -> 6521 | S30: =$R30/$O30 -> 228.40579873120473 | T30: =$L30/300 -> 0.76133501994831843 | U30: =L30/(F30+G30) -> 4.3923174227787607
B31: XSLT2 | C31: 40 | D31: 6 | E31: 27 | F31: 137 | G31: 122 | H31: =$F31/$G31 -> 1.1229508196721312 | I31: =$D31*(LOG10($D31)/LOG10(2))+$E31*(LOG10($E31)/LOG10(2)) -> 143.89173756274059 | J31: =$F31+$G31 -> 259 | K31: =ROUND(100*(MAX(ROUNDUP($I31,0),$J31)-MIN(ROUNDUP($I31,0),$J31))/MAX(ROUNDUP($I31,0),$J31),0) -> 44 | L31: =($F31+$G31)*LOG10($D31+$E31)/LOG10(2) -> 1306.4980769138394 | M31: =2*$E31/($D31*$G31) -> 7.3770491803278687E-2 | N31: =8/$L31 -> 6.1232390168512903E-3 | O31: =1/$N31 -> 163.31225961422993 | P31: =$M31*$L31 -> 96.381005673971757 | Q31: =8*$N31 -> 4.8985912134810322E-2 | R31: =ROUNDUP($L31/$N31,0) -> 213368 | S31: =$R31/$O31 -> 1306.5032625475262 | T31: =$L31/300 -> 4.354993589712798 | U31: =L31/(F31+G31) -> 5.0443941193584534
A32: 8 | B32: Prolog | C32: 11 | D32: 16 | E32: 20 | F32: 58 | G32: 31 | H32: =$F32/$G32 -> 1.8709677419354838 | I32: =$D32*(LOG10($D32)/LOG10(2))+$E32*(LOG10($E32)/LOG10(2)) -> 150.43856189774726 | J32: =$F32+$G32 -> 89 | K32: =ROUND(100*(MAX(ROUNDUP($I32,0),$J32)-MIN(ROUNDUP($I32,0),$J32))/MAX(ROUNDUP($I32,0),$J32),0) -> 41 | L32: =($F32+$G32)*LOG10($D32+$E32)/LOG10(2) -> 460.12332512836582 | M32: =2*$E32/($D32*$G32) -> 8.0645161290322578E-2 | N32: =8/$L32 -> 1.738664302177715E-2 | O32: =1/$N32 -> 57.515415641045728 | P32: =$M32*$L32 -> 37.106719768416596 | Q32: =8*$N32 -> 0.1390931441742172 | R32: =ROUNDUP($L32/$N32,0) -> 26465 | S32: =$R32/$O32 -> 460.13750757133226 | T32: =$L32/300 -> 1.5337444170945527 | U32: =L32/(F32+G32) -> 5.1699250014423122
B33: XSLT | C33: 12 | D33: 6 | E33: 7 | F33: 8 | G33: 7 | H33: =$F33/$G33 -> 1.1428571428571428 | I33: =$D33*(LOG10($D33)/LOG10(2))+$E33*(LOG10($E33)/LOG10(2)) -> 35.161259458730164 | J33: =$F33+$G33 -> 15 | K33: =ROUND(100*(MAX(ROUNDUP($I33,0),$J33)-MIN(ROUNDUP($I33,0),$J33))/MAX(ROUNDUP($I33,0),$J33),0) -> 58 | L33: =($F33+$G33)*LOG10($D33+$E33)/LOG10(2) -> 55.506595772116377 | M33: =2*$E33/($D33*$G33) -> 0.33333333333333331 | N33: =8/$L33 -> 0.14412701569457054 | O33: =1/$N33 -> 6.9383244715145471 | P33: =$M33*$L33 -> 18.502198590705458 | Q33: =8*$N33 -> 1.1530161255565643 | R33: =ROUNDUP($L33/$N33,0) -> 386 | S33: =$R33/$O33 -> 55.63302805810423 | T33: =$L33/300 -> 0.1850219859070546 | U33: =L33/(F33+G33) -> 3.7004397181410917
B34: XSLT2 | C34: 12 | D34: 6 | E34: 18 | F34: 41 | G34: 38 | H34: =$F34/$G34 -> 1.0789473684210527 | I34: =$D34*(LOG10($D34)/LOG10(2))+$E34*(LOG10($E34)/LOG10(2)) -> 90.568425030288552 | J34: =$F34+$G34 -> 79 | K34: =ROUND(100*(MAX(ROUNDUP($I34,0),$J34)-MIN(ROUNDUP($I34,0),$J34))/MAX(ROUNDUP($I34,0),$J34),0) -> 13 | L34: =($F34+$G34)*LOG10($D34+$E34)/LOG10(2) -> 362.21203755697132 | M34: =2*$E34/($D34*$G34) -> 0.15789473684210525 | N34: =8/$L34 -> 2.2086510580813325E-2 | O34: =1/$N34 -> 45.276504694621416 | P34: =$M34*$L34 -> 57.191374351100734 | Q34: =8*$N34 -> 0.1766920846465066 | R34: =ROUNDUP($L34/$N34,0) -> 16400 | S34: =$R34/$O34 -> 362.21877352533852 | T34: =$L34/300 -> 1.2073734585232379 | U34: =L34/(F34+G34) -> 4.5849625007211561
A35: 9 | B35: Prolog | C35: 17 | D35: 15 | E35: 33 | F35: 178 | G35: 91 | H35: =$F35/$G35 -> 1.956043956043956 | I35: =$D35*(LOG10($D35)/LOG10(2))+$E35*(LOG10($E35)/LOG10(2)) -> 225.06836487295675 | J35: =$F35+$G35 -> 269 | K35: =ROUND(100*(MAX(ROUNDUP($I35,0),$J35)-MIN(ROUNDUP($I35,0),$J35))/MAX(ROUNDUP($I35,0),$J35),0) -> 16 | L35: =($F35+$G35)*LOG10($D35+$E35)/LOG10(2) -> 1502.3549126939909 | M35: =2*$E35/($D35*$G35) -> 4.8351648351648353E-2 | N35: =8/$L35 -> 5.3249734349752088E-3 | O35: =1/$N35 -> 187.79436408674886 | P35: =$M35*$L35 -> 72.64133643795121 | Q35: =8*$N35 -> 4.2599787479801671E-2 | R35: =ROUNDUP($L35/$N35,0) -> 282134 | S35: =$R35/$O35 -> 1502.3560551032954 | T35: =$L35/300 -> 5.0078497089799692 | U35: =L35/(F35+G35) -> 5.5849625007211552
B36: XSLT | C36: 37 | D36: 6 | E36: 18 | F36: 26 | G36: 27 | H36: =$F36/$G36 -> 0.96296296296296291 | I36: =$D36*(LOG10($D36)/LOG10(2))+$E36*(LOG10($E36)/LOG10(2)) -> 90.568425030288552 | J36: =$F36+$G36 -> 53 | K36: =ROUND(100*(MAX(ROUNDUP($I36,0),$J36)-MIN(ROUNDUP($I36,0),$J36))/MAX(ROUNDUP($I36,0),$J36),0) -> 42 | L36: =($F36+$G36)*LOG10($D36+$E36)/LOG10(2) -> 243.00301253822124 | M36: =2*$E36/($D36*$G36) -> 0.22222222222222221 | N36: =8/$L36 -> 3.2921402563853827E-2 | O36: =1/$N36 -> 30.375376567277652 | P36: =$M36*$L36 -> 54.000669452938048 | Q36: =8*$N36 -> 0.26337122051083062 | R36: =ROUNDUP($L36/$N36,0) -> 7382 | S36: =$R36/$O36 -> 243.02579372636896 | T36: =$L36/300 -> 0.81001004179407077 | U36: =L36/(F36+G36) -> 4.5849625007211552
B37: XSLT2 | C37: 37 | D37: 7 | E37: 22 | F37: 138 | G37: 119 | H37: =$F37/$G37 -> 1.1596638655462186 | I37: =$D37*(LOG10($D37)/LOG10(2))+$E37*(LOG10($E37)/LOG10(2)) -> 117.75898006442377 | J37: =$F37+$G37 -> 257 | K37: =ROUND(100*(MAX(ROUNDUP($I37,0),$J37)-MIN(ROUNDUP($I37,0),$J37))/MAX(ROUNDUP($I37,0),$J37),0) -> 54 | L37: =($F37+$G37)*LOG10($D37+$E37)/LOG10(2) -> 1248.5011157477861 | M37: =2*$E37/($D37*$G37) -> 5.2821128451380553E-2 | N37: =8/$L37 -> 6.407683500713913E-3 | O37: =1/$N37 -> 156.06263946847326 | P37: =$M37*$L37 -> 65.947237806605756 | Q37: =8*$N37 -> 5.1261468005711304E-2 | R37: =ROUNDUP($L37/$N37,0) -> 194845 | S37: =$R37/$O37 -> 1248.5050916966022 | T37: =$L37/300 -> 4.1616703858259534 | U37: =L37/(F37+G37) -> 4.8579809951275728
A38: 10 | B38: Prolog | C38: 27 | D38: 24 | E38: 37 | F38: 135 | G38: 75 | H38: =$F38/$G38 -> 1.8 | I38: =$D38*(LOG10($D38)/LOG10(2))+$E38*(LOG10($E38)/LOG10(2)) -> 302.78887454557889 | J38: =$F38+$G38 -> 210 | K38: =ROUND(100*(MAX(ROUNDUP($I38,0),$J38)-MIN(ROUNDUP($I38,0),$J38))/MAX(ROUNDUP($I38,0),$J38),0) -> 31 | L38: =($F38+$G38)*LOG10($D38+$E38)/LOG10(2) -> 1245.4548408882063 | M38: =2*$E38/($D38*$G38) -> 4.1111111111111112E-2 | N38: =8/$L38 -> 6.4233561405524229E-3 | O38: =1/$N38 -> 155.68185511102578 | P38: =$M38*$L38 -> 51.202032347626258 | Q38: =8*$N38 -> 5.1386849124419383E-2 | R38: =ROUNDUP($L38/$N38,0) -> 193895 | S38: =$R38/$O38 -> 1245.456638872412 | T38: =$L38/300 -> 4.1515161362940205 | U38: =L38/(F38+G38) -> 5.9307373375628867
B39: Prolog2 | C39: 25 | D39: 22 | E39: 37 | F39: 134 | G39: 75 | H39: =$F39/$G39 -> 1.7866666666666666 | I39: =$D39*(LOG10($D39)/LOG10(2))+$E39*(LOG10($E39)/LOG10(2)) -> 290.85727013829171 | J39: =$F39+$G39 -> 209 | K39: =ROUND(100*(MAX(ROUNDUP($I39,0),$J39)-MIN(ROUNDUP($I39,0),$J39))/MAX(ROUNDUP($I39,0),$J39),0) -> 28 | L39: =($F39+$G39)*LOG10($D39+$E39)/LOG10(2) -> 1229.4723973166249 | M39: =2*$E39/($D39*$G39) -> 4.4848484848484846E-2 | N39: =8/$L39 -> 6.5068561258148907E-3 | O39: =1/$N39 -> 153.68404966457811 | P39: =$M39*$L39 -> 55.139974182684995 | Q39: =8*$N39 -> 5.2054849006519126E-2 | R39: =ROUNDUP($L39/$N39,0) -> 188951 | S39: =$R39/$O39 -> 1229.4769718288494 | T39: =$L39/300 -> 4.0982413243887494 | U39: =L39/(F39+G39) -> 5.8826430493618416
B40: XSLT | C40: 29 | D40: 6 | E40: 13 | F40: 20 | G40: 25 | H40: =$F40/$G40 -> 0.8 | I40: =$D40*(LOG10($D40)/LOG10(2))+$E40*(LOG10($E40)/LOG10(2)) -> 63.615491340161128 | J40: =$F40+$G40 -> 45 | K40: =ROUND(100*(MAX(ROUNDUP($I40,0),$J40)-MIN(ROUNDUP($I40,0),$J40))/MAX(ROUNDUP($I40,0),$J40),0) -> 30 | L40: =($F40+$G40)*LOG10($D40+$E40)/LOG10(2) -> 191.15673810496131 | M40: =2*$E40/($D40*$G40) -> 0.17333333333333334 | N40: =8/$L40 -> 4.1850473487402361E-2 | O40: =1/$N40 -> 23.894592263120163 | P40: =$M40*$L40 -> 33.133834604859963 | Q40: =8*$N40 -> 0.33480378789921889 | R40: =ROUNDUP($L40/$N40,0) -> 4568 | S40: =$R40/$O40 -> 191.17296289045399 | T40: =$L40/300 -> 0.63718912701653774 | U40: =L40/(F40+G40) -> 4.2479275134435843
B41: XSLT2 | C41: 29 | D41: 7 | E41: 21 | F41: 111 | G41: 102 | H41: =$F41/$G41 -> 1.088235294117647 | I41: =$D41*(LOG10($D41)/LOG10(2))+$E41*(LOG10($E41)/LOG10(2)) -> 111.8901503327572 | J41: =$F41+$G41 -> 213 | K41: =ROUND(100*(MAX(ROUNDUP($I41,0),$J41)-MIN(ROUNDUP($I41,0),$J41))/MAX(ROUNDUP($I41,0),$J41),0) -> 47 | L41: =($F41+$G41)*LOG10($D41+$E41)/LOG10(2) -> 1023.9665983982696 | M41: =2*$E41/($D41*$G41) -> 5.8823529411764705E-2 | N41: =8/$L41 -> 7.8127548423102145E-3 | O41: =1/$N41 -> 127.9958247997837 | P41: =$M41*$L41 -> 60.23332931754527 | Q41: =8*$N41 -> 6.2502038738481716E-2 | R41: =ROUNDUP($L41/$N41,0) -> 131064 | S41: =$R41/$O41 -> 1023.970900652546 | T41: =$L41/300 -> 3.4132219946608986 | U41: =L41/(F41+G41) -> 4.8073549220576037
A42: 12 | B42: Prolog | C42: 12 | D42: 16 | E42: 24 | F42: 79 | G42: 43 | H42: =$F42/$G42 -> 1.8372093023255813 | I42: =$D42*(LOG10($D42)/LOG10(2))+$E42*(LOG10($E42)/LOG10(2)) -> 174.03910001730776 | J42: =$F42+$G42 -> 122 | K42: =ROUND(100*(MAX(ROUNDUP($I42,0),$J42)-MIN(ROUNDUP($I42,0),$J42))/MAX(ROUNDUP($I42,0),$J42),0) -> 30 | L42: =($F42+$G42)*LOG10($D42+$E42)/LOG10(2) -> 649.2752275762582 | M42: =2*$E42/($D42*$G42) -> 6.9767441860465115E-2 | N42: =8/$L42 -> 1.232143112846607E-2 | O42: =1/$N42 -> 81.159403447032275 | P42: =$M42*$L42 -> 45.29827169136685 | Q42: =8*$N42 -> 9.8571449027728561E-2 | R42: =ROUNDUP($L42/$N42,0) -> 52695 | S42: =$R42/$O42 -> 649.27781331451956 | T42: =$L42/300 -> 2.1642507585875275 | U42: =L42/(F42+G42) -> 5.3219280948873626
B43: Prolog2 | C43: 11 | D43: 13 | E43: 23 | F43: 69 | G43: 36 | H43: =$F43/$G43 -> 1.9166666666666667 | I43: =$D43*(LOG10($D43)/LOG10(2))+$E43*(LOG10($E43)/LOG10(2)) -> 152.14764132514549 | J43: =$F43+$G43 -> 105 | K43: =ROUND(100*(MAX(ROUNDUP($I43,0),$J43)-MIN(ROUNDUP($I43,0),$J43))/MAX(ROUNDUP($I43,0),$J43),0) -> 31 | L43: =($F43+$G43)*LOG10($D43+$E43)/LOG10(2) -> 542.84212515144281 | M43: =2*$E43/($D43*$G43) -> 9.8290598290598288E-2 | N43: =8/$L43 -> 1.4737249799411108E-2 | O43: =1/$N43 -> 67.855265643930352 | P43: =$M43*$L43 -> 53.356277258475146 | Q43: =8*$N43 -> 0.11789799839528886 | R43: =ROUNDUP($L43/$N43,0) -> 36835 | S43: =$R43/$O43 -> 542.84659636130812 | T43: =$L43/300 -> 1.8094737505048093 | U43: =L43/(F43+G43) -> 5.1699250014423122
B44: XSLT | C44: 17 | D44: 6 | E44: 7 | F44: 10 | G44: 7 | H44: =$F44/$G44 -> 1.4285714285714286 | I44: =$D44*(LOG10($D44)/LOG10(2))+$E44*(LOG10($E44)/LOG10(2)) -> 35.161259458730164 | J44: =$F44+$G44 -> 17 | K44: =ROUND(100*(MAX(ROUNDUP($I44,0),$J44)-MIN(ROUNDUP($I44,0),$J44))/MAX(ROUNDUP($I44,0),$J44),0) -> 53 | L44: =($F44+$G44)*LOG10($D44+$E44)/LOG10(2) -> 62.907475208398566 | M44: =2*$E44/($D44*$G44) -> 0.33333333333333331 | N44: =8/$L44 -> 0.12717089620109165 | O44: =1/$N44 -> 7.8634344010498207 | P44: =$M44*$L44 -> 20.969158402799522 | Q44: =8*$N44 -> 1.0173671696087332 | R44: =ROUNDUP($L44/$N44,0) -> 495 | S44: =$R44/$O44 -> 62.949593619540366 | T44: =$L44/300 -> 0.20969158402799523 | U44: =L44/(F44+G44) -> 3.7004397181410922
A45: 13 | B45: Prolog | C45: 8 | D45: 14 | E45: 18 | F45: 52 | G45: 27 | H45: =$F45/$G45 -> 1.9259259259259258 | I45: =$D45*(LOG10($D45)/LOG10(2))+$E45*(LOG10($E45)/LOG10(2)) -> 128.36161893476805 | J45: =$F45+$G45 -> 79 | K45: =ROUND(100*(MAX(ROUNDUP($I45,0),$J45)-MIN(ROUNDUP($I45,0),$J45))/MAX(ROUNDUP($I45,0),$J45),0) -> 39 | L45: =($F45+$G45)*LOG10($D45+$E45)/LOG10(2) -> 395 | M45: =2*$E45/($D45*$G45) -> 9.5238095238095233E-2 | N45: =8/$L45 -> 2.0253164556962026E-2 | O45: =1/$N45 -> 49.375 | P45: =$M45*$L45 -> 37.61904761904762 | Q45: =8*$N45 -> 0.16202531645569621 | R45: =ROUNDUP($L45/$N45,0) -> 19504 | S45: =$R45/$O45 -> 395.01772151898734 | T45: =$L45/300 -> 1.3166666666666667 | U45: =L45/(F45+G45) -> 5
B46: XSLT | C46: 16 | D46: 7 | E46: 7 | F46: 10 | G46: 9 | H46: =$F46/$G46 -> 1.1111111111111112 | I46: =$D46*(LOG10($D46)/LOG10(2))+$E46*(LOG10($E46)/LOG10(2)) -> 39.302968908806456 | J46: =$F46+$G46 -> 19 | K46: =ROUND(100*(MAX(ROUNDUP($I46,0),$J46)-MIN(ROUNDUP($I46,0),$J46))/MAX(ROUNDUP($I46,0),$J46),0) -> 53 | L46: =($F46+$G46)*LOG10($D46+$E46)/LOG10(2) -> 72.339743519094469 | M46: =2*$E46/($D46*$G46) -> 0.22222222222222221 | N46: =8/$L46 -> 0.1105892779103973 | O46: =1/$N46 -> 9.0424679398868086 | P46: =$M46*$L46 -> 16.075498559798771 | Q46: =8*$N46 -> 0.88471422328317839 | R46: =ROUNDUP($L46/$N46,0) -> 655 | S46: =$R46/$O46 -> 72.43597703131023 | T46: =$L46/300 -> 0.24113247839698157 | U46: =L46/(F46+G46) -> 3.8073549220576037
A47: 14 | B47: Prolog | C47: 9 | D47: 14 | E47: 17 | F47: 52 | G47: 27 | H47: =$F47/$G47 -> 1.9259259259259258 | I47: =$D47*(LOG10($D47)/LOG10(2))+$E47*(LOG10($E47)/LOG10(2)) -> 122.78983721006222 | J47: =$F47+$G47 -> 79 | K47: =ROUND(100*(MAX(ROUNDUP($I47,0),$J47)-MIN(ROUNDUP($I47,0),$J47))/MAX(ROUNDUP($I47,0),$J47),0) -> 36 | L47: =($F47+$G47)*LOG10($D47+$E47)/LOG10(2) -> 391.38150852056316 | M47: =2*$E47/($D47*$G47) -> 8.9947089947089942E-2 | N47: =8/$L47 -> 2.0440413831098719E-2 | O47: =1/$N47 -> 48.922688565070395 | P47: =$M47*$L47 -> 35.203627750526842 | Q47: =8*$N47 -> 0.16352331064878975 | R47: =ROUNDUP($L47/$N47,0) -> 19148 | S47: =$R47/$O47 -> 391.39304403787827 | T47: =$L47/300 -> 1.3046050284018771 | U47: =L47/(F47+G47) -> 4.9541963103868758
B48: Prolog2 | C48: 22 | D48: 19 | E48: 22 | F48: 122 | G48: 58 | H48: =$F48/$G48 -> 2.103448275862069 | I48: =$D48*(LOG10($D48)/LOG10(2))+$E48*(LOG10($E48)/LOG10(2)) -> 178.81811836544864 | J48: =$F48+$G48 -> 180 | K48: =ROUND(100*(MAX(ROUNDUP($I48,0),$J48)-MIN(ROUNDUP($I48,0),$J48))/MAX(ROUNDUP($I48,0),$J48),0) -> 1 | L48: =($F48+$G48)*LOG10($D48+$E48)/LOG10(2) -> 964.359360831255 | M48: =2*$E48/($D48*$G48) -> 3.9927404718693285E-2 | N48: =8/$L48 -> 8.2956627217308163E-3 | O48: =1/$N48 -> 120.54492010390689 | P48: =$M48*$L48 -> 38.504366494169894 | Q48: =8*$N48 -> 6.636530177384653E-2 | R48: =ROUNDUP($L48/$N48,0) -> 116249 | S48: =$R48/$O48 -> 964.36249573848568 | T48: =$L48/300 -> 3.2145312027708499 | U48: =L48/(F48+G48) -> 5.3575520046180838
B49: Prolog3 | C49: 16 | D49: 17 | E49: 22 | F49: 81 | G49: 43 | H49: =$F49/$G49 -> 1.8837209302325582 | I49: =$D49*(LOG10($D49)/LOG10(2))+$E49*(LOG10($E49)/LOG10(2)) -> 167.5943639112763 | J49: =$F49+$G49 -> 124 | K49: =ROUND(100*(MAX(ROUNDUP($I49,0),$J49)-MIN(ROUNDUP($I49,0),$J49))/MAX(ROUNDUP($I49,0),$J49),0) -> 26 | L49: =($F49+$G49)*LOG10($D49+$E49)/LOG10(2) -> 655.3898751389188 | M49: =2*$E49/($D49*$G49) -> 6.0191518467852256E-2 | N49: =8/$L49 -> 1.2206474807540002E-2 | O49: =1/$N49 -> 81.92373439236485 | P49: =$M49*$L49 -> 39.448911773067614 | Q49: =8*$N49 -> 9.7651798460320016E-2 | R49: =ROUNDUP($L49/$N49,0) -> 53692 | S49: =$R49/$O49 -> 655.39004536643779 | T49: =$L49/300 -> 2.1846329171297292 | U49: =L49/(F49+G49) -> 5.2854022188622487
B50: XSLT | C50: 9 | D50: 5 | E50: 5 | F50: 5 | G50: 5 | H50: =$F50/$G50 -> 1 | I50: =$D50*(LOG10($D50)/LOG10(2))+$E50*(LOG10($E50)/LOG10(2)) -> 23.219280948873624 | J50: =$F50+$G50 -> 10 | K50: =ROUND(100*(MAX(ROUNDUP($I50,0),$J50)-MIN(ROUNDUP($I50,0),$J50))/MAX(ROUNDUP($I50,0),$J50),0) -> 58 | L50: =($F50+$G50)*LOG10($D50+$E50)/LOG10(2) -> 33.219280948873624 | M50: =2*$E50/($D50*$G50) -> 0.4 | N50: =8/$L50 -> 0.24082399653118494 | O50: =1/$N50 -> 4.1524101186092031 | P50: =$M50*$L50 -> 13.287712379549451 | Q50: =8*$N50 -> 1.9265919722494795 | R50: =ROUNDUP($L50/$N50,0) -> 138 | S50: =$R50/$O50 -> 33.233711521303526 | T50: =$L50/300 -> 0.11073093649624542 | U50: =L50/(F50+G50) -> 3.3219280948873626
A51: 15 | B51: Prolog | C51: 29 | D51: 23 | E51: 32 | F51: 189 | G51: 85 | H51: =$F51/$G51 -> 2.223529411764706 | I51: =$D51*(LOG10($D51)/LOG10(2))+$E51*(LOG10($E51)/LOG10(2)) -> 264.04192498931127 | J51: =$F51+$G51 -> 274 | K51: =ROUND(100*(MAX(ROUNDUP($I51,0),$J51)-MIN(ROUNDUP($I51,0),$J51))/MAX(ROUNDUP($I51,0),$J51),0) -> 3 | L51: =($F51+$G51)*LOG10($D51+$E51)/LOG10(2) -> 1584.0925615057567 | M51: =2*$E51/($D51*$G51) -> 3.2736572890025573E-2 | N51: =8/$L51 -> 5.0502099400022513E-3 | O51: =1/$N51 -> 198.01157018821959 | P51: =$M51*$L51 -> 51.857761604280526 | Q51: =8*$N51 -> 4.0401679520018011E-2 | R51: =ROUNDUP($L51/$N51,0) -> 313669 | S51: =$R51/$O51 -> 1584.094301670566 | T51: =$L51/300 -> 5.2803085383525223 | U51: =L51/(F51+G51) -> 5.7813597135246599
B52: Prolog2 | C52: 28 | D52: 21 | E52: 37 | F52: 187 | G52: 92 | H52: =$F52/$G52 -> 2.0326086956521738 | I52: =$D52*(LOG10($D52)/LOG10(2))+$E52*(LOG10($E52)/LOG10(2)) -> 284.98844040662516 | J52: =$F52+$G52 -> 279 | K52: =ROUND(100*(MAX(ROUNDUP($I52,0),$J52)-MIN(ROUNDUP($I52,0),$J52))/MAX(ROUNDUP($I52,0),$J52),0) -> 2 | L52: =($F52+$G52)*LOG10($D52+$E52)/LOG10(2) -> 1634.3766976405927 | M52: =2*$E52/($D52*$G52) -> 3.8302277432712216E-2 | N52: =8/$L52 -> 4.8948323917912574E-3 | O52: =1/$N52 -> 204.29708720507412 | P52: =$M52*$L52 -> 62.600349702589995 | Q52: =8*$N52 -> 3.9158659134330059E-2 | R52: =ROUNDUP($L52/$N52,0) -> 333899 | S52: =$R52/$O52 -> 1634.3796407867089 | T52: =$L52/300 -> 5.4479223254686424 | U52: =L52/(F52+G52) -> 5.8579809951275728
B53: XSLT | C53: 32 | D53: 10 | E53: 13 | F53: 20 | G53: 15 | H53: =$F53/$G53 -> 1.3333333333333333 | I53: =$D53*(LOG10($D53)/LOG10(2))+$E53*(LOG10($E53)/LOG10(2)) -> 81.32499728470782 | J53: =$F53+$G53 -> 35 | K53: =ROUND(100*(MAX(ROUNDUP($I53,0),$J53)-MIN(ROUNDUP($I53,0),$J53))/MAX(ROUNDUP($I53,0),$J53),0) -> 57 | L53: =($F53+$G53)*LOG10($D53+$E53)/LOG10(2) -> 158.32466846199546 | M53: =2*$E53/($D53*$G53) -> 0.17333333333333334 | N53: =8/$L53 -> 5.0529081018857995E-2 | O53: =1/$N53 -> 19.790583557749432 | P53: =$M53*$L53 -> 27.442942533412548 | Q53: =8*$N53 -> 0.40423264815086396 | R53: =ROUNDUP($L53/$N53,0) -> 3134 | S53: =$R53/$O53 -> 158.35813991310096 | T53: =$L53/300 -> 0.52774889487331822 | U53: =L53/(F53+G53) -> 4.5235619560570131
A54: 17 | B54: Prolog | C54: 17 | D54: 18 | E54: 34 | F54: 139 | G54: 67 | H54: =$F54/$G54 -> 2.0746268656716418 | I54: =$D54*(LOG10($D54)/LOG10(2))+$E54*(LOG10($E54)/LOG10(2)) -> 248.03238662847315 | J54: =$F54+$G54 -> 206 | K54: =ROUND(100*(MAX(ROUNDUP($I54,0),$J54)-MIN(ROUNDUP($I54,0),$J54))/MAX(ROUNDUP($I54,0),$J54),0) -> 17 | L54: =($F54+$G54)*LOG10($D54+$E54)/LOG10(2) -> 1174.2905819370651 | M54: =2*$E54/($D54*$G54) -> 5.6384742951907131E-2 | N54: =8/$L54 -> 6.812623828425418E-3 | O54: =1/$N54 -> 146.78632274213314 | P54: =$M54*$L54 -> 66.212072613366857 | Q54: =8*$N54 -> 5.4500990627403344E-2 | R54: =ROUNDUP($L54/$N54,0) -> 172370 | S54: =$R54/$O54 -> 1174.2919693056892 | T54: =$L54/300 -> 3.9143019397902168 | U54: =L54/(F54+G54) -> 5.7004397181410926
B55: Prolog2 | C55: 21 | D55: 21 | E55: 36 | F55: 170 | G55: 87 | H55: =$F55/$G55 -> 1.9540229885057472 | I55: =$D55*(LOG10($D55)/LOG10(2))+$E55*(LOG10($E55)/LOG10(2)) -> 278.35596593027719 | J55: =$F55+$G55 -> 257 | K55: =ROUND(100*(MAX(ROUNDUP($I55,0),$J55)-MIN(ROUNDUP($I55,0),$J55))/MAX(ROUNDUP($I55,0),$J55),0) -> 8 | L55: =($F55+$G55)*LOG10($D55+$E55)/LOG10(2) -> 1499.0527336403388 | M55: =2*$E55/($D55*$G55) -> 3.9408866995073892E-2 | N55: =8/$L55 -> 5.3367035198105348E-3 | O55: =1/$N55 -> 187.38159170504235 | P55: =$M55*$L55 -> 59.075969798634041 | Q55: =8*$N55 -> 4.2693628158484279E-2 | R55: =ROUNDUP($L55/$N55,0) -> 280895 | S55: =$R55/$O55 -> 1499.0533351971801 | T55: =$L55/300 -> 4.996842445467796 | U55: =L55/(F55+G55) -> 5.8328900141647422
B56: XSLT | C56: 32 | D56: 9 | E56: 9 | F56: 20 | G56: 11 | H56: =$F56/$G56 -> 1.8181818181818181 | I56: =$D56*(LOG10($D56)/LOG10(2))+$E56*(LOG10($E56)/LOG10(2)) -> 57.058650025961619 | J56: =$F56+$G56 -> 31 | K56: =ROUND(100*(MAX(ROUNDUP($I56,0),$J56)-MIN(ROUNDUP($I56,0),$J56))/MAX(ROUNDUP($I56,0),$J56),0) -> 47 | L56: =($F56+$G56)*LOG10($D56+$E56)/LOG10(2) -> 129.26767504471167 | M56: =2*$E56/($D56*$G56) -> 0.18181818181818182 | N56: =8/$L56 -> 6.1887088146614574E-2 | O56: =1/$N56 -> 16.158459380588958 | P56: =$M56*$L56 -> 23.50321364449303 | Q56: =8*$N56 -> 0.4950967051729166 | R56: =ROUNDUP($L56/$N56,0) -> 2089 | S56: =$R56/$O56 -> 129.28212713827784 | T56: =$L56/300 -> 0.43089225014903887 | U56: =L56/(F56+G56) -> 4.1699250014423122
A57: 18 | B57: Prolog | C57: 22 | D57: 21 | E57: 24 | F57: 129 | G57: 56 | H57: =$F57/$G57 -> 2.3035714285714284 | I57: =$D57*(LOG10($D57)/LOG10(2))+$E57*(LOG10($E57)/LOG10(2)) -> 202.27776589566173 | J57: =$F57+$G57 -> 185 | K57: =ROUND(100*(MAX(ROUNDUP($I57,0),$J57)-MIN(ROUNDUP($I57,0),$J57))/MAX(ROUNDUP($I57,0),$J57),0) -> 9 | L57: =($F57+$G57)*LOG10($D57+$E57)/LOG10(2) -> 1015.9928228209899 | M57: =2*$E57/($D57*$G57) -> 4.0816326530612242E-2 | N57: =8/$L57 -> 7.8740713716730047E-3 | O57: =1/$N57 -> 126.99910285262374 | P57: =$M57*$L57 -> 41.469094809019992 | Q57: =8*$N57 -> 6.2992570973384038E-2 | R57: =ROUNDUP($L57/$N57,0) -> 129031 | S57: =$R57/$O57 -> 1015.9993031583394 | T57: =$L57/300 -> 3.3866427427366328 | U57: =L57/(F57+G57) -> 5.4918530963296748
B58: XSLT | C58: 19 | D58: 6 | E58: 10 | F58: 12 | G58: 13 | H58: =$F58/$G58 -> 0.92307692307692313 | I58: =$D58*(LOG10($D58)/LOG10(2))+$E58*(LOG10($E58)/LOG10(2)) -> 48.729055953200557 | J58: =$F58+$G58 -> 25 | K58: =ROUND(100*(MAX(ROUNDUP($I58,0),$J58)-MIN(ROUNDUP($I58,0),$J58))/MAX(ROUNDUP($I58,0),$J58),0) -> 49 | L58: =($F58+$G58)*LOG10($D58+$E58)/LOG10(2) -> 100 | M58: =2*$E58/($D58*$G58) -> 0.25641025641025639 | N58: =8/$L58 -> 0.08 | O58: =1/$N58 -> 12.5 | P58: =$M58*$L58 -> 25.641025641025639 | Q58: =8*$N58 -> 0.64 | R58: =ROUNDUP($L58/$N58,0) -> 1250 | S58: =$R58/$O58 -> 100 | T58: =$L58/300 -> 0.33333333333333331 | U58: =L58/(F58+G58) -> 4
A59: 19 | B59: Prolog | C59: 12 | D59: 17 | E59: 19 | F59: 66 | G59: 33 | H59: =$F59/$G59 -> 2 | I59: =$D59*(LOG10($D59)/LOG10(2))+$E59*(LOG10($E59)/LOG10(2)) -> 150.19749105668387 | J59: =$F59+$G59 -> 99 | K59: =ROUND(100*(MAX(ROUNDUP($I59,0),$J59)-MIN(ROUNDUP($I59,0),$J59))/MAX(ROUNDUP($I59,0),$J59),0) -> 34 | L59: =($F59+$G59)*LOG10($D59+$E59)/LOG10(2) -> 511.82257514278888 | M59: =2*$E59/($D59*$G59) -> 6.7736185383244205E-2 | N59: =8/$L59 -> 1.5630416453920874E-2 | O59: =1/$N59 -> 63.97782189284861 | P59: =$M59*$L59 -> 34.668908833201385 | Q59: =8*$N59 -> 0.12504333163136699 | R59: =ROUNDUP($L59/$N59,0) -> 32746 | S59: =$R59/$O59 -> 511.83361720009293 | T59: =$L59/300 -> 1.7060752504759629 | U59: =L59/(F59+G59) -> 5.1699250014423122
B60: XSLT | C60: 15 | D60: 8 | E60: 6 | F60: 8 | G60: 7 | H60: =$F60/$G60 -> 1.1428571428571428 | I60: =$D60*(LOG10($D60)/LOG10(2))+$E60*(LOG10($E60)/LOG10(2)) -> 39.50977500432694 | J60: =$F60+$G60 -> 15 | K60: =ROUND(100*(MAX(ROUNDUP($I60,0),$J60)-MIN(ROUNDUP($I60,0),$J60))/MAX(ROUNDUP($I60,0),$J60),0) -> 63 | L60: =($F60+$G60)*LOG10($D60+$E60)/LOG10(2) -> 57.110323830864054 | M60: =2*$E60/($D60*$G60) -> 0.21428571428571427 | N60: =8/$L60 -> 0.14007975201983658 | O60: =1/$N60 -> 7.1387904788580068 | P60: =$M60*$L60 -> 12.237926535185153 | Q60: =8*$N60 -> 1.1206380161586926 | R60: =ROUNDUP($L60/$N60,0) -> 408 | S60: =$R60/$O60 -> 57.152538824093327 | T60: =$L60/300 -> 0.19036774610288018 | U60: =L60/(F60+G60) -> 3.8073549220576037
A61: 20 | B61: Prolog | C61: 12 | D61: 16 | E61: 22 | F61: 67 | G61: 36 | H61: =$F61/$G61 -> 1.8611111111111112 | I61: =$D61*(LOG10($D61)/LOG10(2))+$E61*(LOG10($E61)/LOG10(2)) -> 162.10749561002052 | J61: =$F61+$G61 -> 103 | K61: =ROUND(100*(MAX(ROUNDUP($I61,0),$J61)-MIN(ROUNDUP($I61,0),$J61))/MAX(ROUNDUP($I61,0),$J61),0) -> 37 | L61: =($F61+$G61)*LOG10($D61+$E61)/LOG10(2) -> 540.53653388468933 | M61: =2*$E61/($D61*$G61) -> 7.6388888888888895E-2 | N61: =8/$L61 -> 1.480010970305036E-2 | O61: =1/$N61 -> 67.567066735586167 | P61: =$M61*$L61 -> 41.290985227302663 | Q61: =8*$N61 -> 0.11840087762440288 | R61: =ROUNDUP($L61/$N61,0) -> 36523 | S61: =$R61/$O61 -> 540.54440668450832 | T61: =$L61/300 -> 1.8017884462822977 | U61: =L61/(F61+G61) -> 5.2479275134435861
B62: XSLT | C62: 16 | D62: 9 | E62: 7 | F62: 9 | G62: 8 | H62: =$F62/$G62 -> 1.125 | I62: =$D62*(LOG10($D62)/LOG10(2))+$E62*(LOG10($E62)/LOG10(2)) -> 48.180809467384037 | J62: =$F62+$G62 -> 17 | K62: =ROUND(100*(MAX(ROUNDUP($I62,0),$J62)-MIN(ROUNDUP($I62,0),$J62))/MAX(ROUNDUP($I62,0),$J62),0) -> 65 | L62: =($F62+$G62)*LOG10($D62+$E62)/LOG10(2) -> 68 | M62: =2*$E62/($D62*$G62) -> 0.19444444444444445 | N62: =8/$L62 -> 0.11764705882352941 | O62: =1/$N62 -> 8.5 | P62: =$M62*$L62 -> 13.222222222222223 | Q62: =8*$N62 -> 0.94117647058823528 | R62: =ROUNDUP($L62/$N62,0) -> 578 | S62: =$R62/$O62 -> 68 | T62: =$L62/300 -> 0.22666666666666666 | U62: =L62/(F62+G62) -> 4
A63: 21 | B63: Prolog | C63: 15 | D63: 19 | E63: 23 | F63: 80 | G63: 43 | H63: =$F63/$G63 -> 1.8604651162790697 | I63: =$D63*(LOG10($D63)/LOG10(2))+$E63*(LOG10($E63)/LOG10(2)) -> 184.75254774473942 | J63: =$F63+$G63 -> 123 | K63: =ROUND(100*(MAX(ROUNDUP($I63,0),$J63)-MIN(ROUNDUP($I63,0),$J63))/MAX(ROUNDUP($I63,0),$J63),0) -> 34 | L63: =($F63+$G63)*LOG10($D63+$E63)/LOG10(2) -> 663.25504300178761 | M63: =2*$E63/($D63*$G63) -> 5.6303549571603426E-2 | N63: =8/$L63 -> 1.2061725100186594E-2 | O63: =1/$N63 -> 82.906880375223452 | P63: =$M63*$L63 -> 37.343613192267114 | Q63: =8*$N63 -> 9.6493800801492752E-2 | R63: =ROUNDUP($L63/$N63,0) -> 54989 | S63: =$R63/$O63 -> 663.26220153416057 | T63: =$L63/300 -> 2.2108501433392922 | U63: =L63/(F63+G63) -> 5.3923174227787607
B64: Prolog2 | C64: 12 | D64: 17 | E64: 19 | F64: 66 | G64: 32 | H64: =$F64/$G64 -> 2.0625 | I64: =$D64*(LOG10($D64)/LOG10(2))+$E64*(LOG10($E64)/LOG10(2)) -> 150.19749105668387 | J64: =$F64+$G64 -> 98 | K64: =ROUND(100*(MAX(ROUNDUP($I64,0),$J64)-MIN(ROUNDUP($I64,0),$J64))/MAX(ROUNDUP($I64,0),$J64),0) -> 35 | L64: =($F64+$G64)*LOG10($D64+$E64)/LOG10(2) -> 506.65265014134656 | M64: =2*$E64/($D64*$G64) -> 6.985294117647059E-2 | N64: =8/$L64 -> 1.5789910499369047E-2 | O64: =1/$N64 -> 63.331581267668319 | P64: =$M64*$L64 -> 35.391177767226417 | Q64: =8*$N64 -> 0.12631928399495237 | R64: =ROUNDUP($L64/$N64,0) -> 32088 | S64: =$R64/$O64 -> 506.66664810375397 | T64: =$L64/300 -> 1.6888421671378218 | U64: =L64/(F64+G64) -> 5.1699250014423122
B65: XSLT | C65: 15 | D65: 8 | E65: 6 | F65: 8 | G65: 7 | H65: =$F65/$G65 -> 1.1428571428571428 | I65: =$D65*(LOG10($D65)/LOG10(2))+$E65*(LOG10($E65)/LOG10(2)) -> 39.50977500432694 | J65: =$F65+$G65 -> 15 | K65: =ROUND(100*(MAX(ROUNDUP($I65,0),$J65)-MIN(ROUNDUP($I65,0),$J65))/MAX(ROUNDUP($I65,0),$J65),0) -> 63 | L65: =($F65+$G65)*LOG10($D65+$E65)/LOG10(2) -> 57.110323830864054 | M65: =2*$E65/($D65*$G65) -> 0.21428571428571427 | N65: =8/$L65 -> 0.14007975201983658 | O65: =1/$N65 -> 7.1387904788580068 | P65: =$M65*$L65 -> 12.237926535185153 | Q65: =8*$N65 -> 1.1206380161586926 | R65: =ROUNDUP($L65/$N65,0) -> 408 | S65: =$R65/$O65 -> 57.152538824093327 | T65: =$L65/300 -> 0.19036774610288018 | U65: =L65/(F65+G65) -> 3.8073549220576037
A66: 22 | B66: Prolog | C66: 14 | D66: 18 | E66: 15 | F66: 74 | G66: 37 | H66: =$F66/$G66 -> 2 | I66: =$D66*(LOG10($D66)/LOG10(2))+$E66*(LOG10($E66)/LOG10(2)) -> 133.66200896008939 | J66: =$F66+$G66 -> 111 | K66: =ROUND(100*(MAX(ROUNDUP($I66,0),$J66)-MIN(ROUNDUP($I66,0),$J66))/MAX(ROUNDUP($I66,0),$J66),0) -> 17 | L66: =($F66+$G66)*LOG10($D66+$E66)/LOG10(2) -> 559.92774724878825 | M66: =2*$E66/($D66*$G66) -> 4.5045045045045043E-2 | N66: =8/$L66 -> 1.4287557705986347E-2 | O66: =1/$N66 -> 69.990968406098531 | P66: =$M66*$L66 -> 25.221970596792261 | Q66: =8*$N66 -> 0.11430046164789077 | R66: =ROUNDUP($L66/$N66,0) -> 39190 | S66: =$R66/$O66 -> 559.92938649760492 | T66: =$L66/300 -> 1.8664258241626275 | U66: =L66/(F66+G66) -> 5.0443941193584525
B67: XSLT | C67: 10 | D67: 5 | E67: 6 | F67: 5 | G67: 6 | H67: =$F67/$G67 -> 0.83333333333333337 | I67: =$D67*(LOG10($D67)/LOG10(2))+$E67*(LOG10($E67)/LOG10(2)) -> 27.119415478763749 | J67: =$F67+$G67 -> 11 | K67: =ROUND(100*(MAX(ROUNDUP($I67,0),$J67)-MIN(ROUNDUP($I67,0),$J67))/MAX(ROUNDUP($I67,0),$J67),0) -> 61 | L67: =($F67+$G67)*LOG10($D67+$E67)/LOG10(2) -> 38.053747805010275 | M67: =2*$E67/($D67*$G67) -> 0.4 | N67: =8/$L67 -> 0.21022896459482751 | O67: =1/$N67 -> 4.7567184756262844 | P67: =$M67*$L67 -> 15.221499122004111 | Q67: =8*$N67 -> 1.6818317167586201 | R67: =ROUNDUP($L67/$N67,0) -> 182 | S67: =$R67/$O67 -> 38.261671556258605 | T67: =$L67/300 -> 0.12684582601670091 | U67: =L67/(F67+G67) -> 3.4594316186372978
A68: 23 | B68: Prolog | C68: 11 | D68: 15 | E68: 20 | F68: 62 | G68: 34 | H68: =$F68/$G68 -> 1.8235294117647058 | I68: =$D68*(LOG10($D68)/LOG10(2))+$E68*(LOG10($E68)/LOG10(2)) -> 145.04192083187502 | J68: =$F68+$G68 -> 96 | K68: =ROUND(100*(MAX(ROUNDUP($I68,0),$J68)-MIN(ROUNDUP($I68,0),$J68))/MAX(ROUNDUP($I68,0),$J68),0) -> 34 | L68: =($F68+$G68)*LOG10($D68+$E68)/LOG10(2) -> 492.4111696267168 | M68: =2*$E68/($D68*$G68) -> 7.8431372549019607E-2 | N68: =8/$L68 -> 1.6246585157815525E-2 | O68: =1/$N68 -> 61.5513962033396 | P68: =$M68*$L68 -> 38.62048389229151 | Q68: =8*$N68 -> 0.1299726812625242 | R68: =ROUNDUP($L68/$N68,0) -> 30309 | S68: =$R68/$O68 -> 492.41774954823074 | T68: =$L68/300 -> 1.6413705654223893 | U68: =L68/(F68+G68) -> 5.1292830169449664
B69: Prolog2 | C69: 14 | D69: 18 | E69: 24 | F69: 85 | G69: 47 | H69: =$F69/$G69 -> 1.8085106382978724 | I69: =$D69*(LOG10($D69)/LOG10(2))+$E69*(LOG10($E69)/LOG10(2)) -> 185.09775004326934 | J69: =$F69+$G69 -> 132 | K69: =ROUND(100*(MAX(ROUNDUP($I69,0),$J69)-MIN(ROUNDUP($I69,0),$J69))/MAX(ROUNDUP($I69,0),$J69),0) -> 29 | L69: =($F69+$G69)*LOG10($D69+$E69)/LOG10(2) -> 711.78589980679635 | M69: =2*$E69/($D69*$G69) -> 5.6737588652482268E-2 | N69: =8/$L69 -> 1.12393347524466E-2 | O69: =1/$N69 -> 88.973237475849544 | P69: =$M69*$L69 -> 40.385015591874968 | Q69: =8*$N69 -> 8.99146780195728E-2 | R69: =ROUNDUP($L69/$N69,0) -> 63330 | S69: =$R69/$O69 -> 711.78706987244323 | T69: =$L69/300 -> 2.3726196660226546 | U69: =L69/(F69+G69) -> 5.3923174227787598
B70: XSLT | C70: 16 | D70: 8 | E70: 6 | F70: 9 | G70: 7 | H70: =$F70/$G70 -> 1.2857142857142858 | I70: =$D70*(LOG10($D70)/LOG10(2))+$E70*(LOG10($E70)/LOG10(2)) -> 39.50977500432694 | J70: =$F70+$G70 -> 16 | K70: =ROUND(100*(MAX(ROUNDUP($I70,0),$J70)-MIN(ROUNDUP($I70,0),$J70))/MAX(ROUNDUP($I70,0),$J70),0) -> 60 | L70: =($F70+$G70)*LOG10($D70+$E70)/LOG10(2) -> 60.91767875292166 | M70: =2*$E70/($D70*$G70) -> 0.21428571428571427 | N70: =8/$L70 -> 0.13132476751859679 | O70: =1/$N70 -> 7.6147098441152075 | P70: =$M70*$L70 -> 13.053788304197498 | Q70: =8*$N70 -> 1.0505981401487743 | R70: =ROUNDUP($L70/$N70,0) -> 464 | S70: =$R70/$O70 -> 60.93469212862891 | T70: =$L70/300 -> 0.20305892917640553 | U70: =L70/(F70+G70) -> 3.8073549220576037
A71: 24 | B71: Prolog | C71: 14 | D71: 16 | E71: 23 | F71: 95 | G71: 49 | H71: =$F71/$G71 -> 1.9387755102040816 | I71: =$D71*(LOG10($D71)/LOG10(2))+$E71*(LOG10($E71)/LOG10(2)) -> 168.0419249893113 | J71: =$F71+$G71 -> 144 | K71: =ROUND(100*(MAX(ROUNDUP($I71,0),$J71)-MIN(ROUNDUP($I71,0),$J71))/MAX(ROUNDUP($I71,0),$J71),0) -> 15 | L71: =($F71+$G71)*LOG10($D71+$E71)/LOG10(2) -> 761.09791951616376 | M71: =2*$E71/($D71*$G71) -> 5.8673469387755105E-2 | N71: =8/$L71 -> 1.0511131084270557E-2 | O71: =1/$N71 -> 95.13723993952047 | P71: =$M71*$L71 -> 44.656255481815734 | Q71: =8*$N71 -> 8.408904867416446E-2 | R71: =ROUNDUP($L71/$N71,0) -> 72409 | S71: =$R71/$O71 -> 761.10049068094679 | T71: =$L71/300 -> 2.536993065053879 | U71: =L71/(F71+G71) -> 5.2854022188622487
B72: Prolog2 | C72: 14 | D72: 16 | E72: 26 | F72: 98 | G72: 52 | H72: =$F72/$G72 -> 1.8846153846153846 | I72: =$D72*(LOG10($D72)/LOG10(2))+$E72*(LOG10($E72)/LOG10(2)) -> 186.21143267166838 | J72: =$F72+$G72 -> 150 | K72: =ROUND(100*(MAX(ROUNDUP($I72,0),$J72)-MIN(ROUNDUP($I72,0),$J72))/MAX(ROUNDUP($I72,0),$J72),0) -> 20 | L72: =($F72+$G72)*LOG10($D72+$E72)/LOG10(2) -> 808.84761341681406 | M72: =2*$E72/($D72*$G72) -> 6.25E-2 | N72: =8/$L72 -> 9.8906145821530071E-3 | O72: =1/$N72 -> 101.10595167710177 | P72: =$M72*$L72 -> 50.552975838550879 | Q72: =8*$N72 -> 7.9124916657224056E-2 | R72: =ROUNDUP($L72/$N72,0) -> 81780 | S72: =$R72/$O72 -> 808.85446052847283 | T72: =$L72/300 -> 2.6961587113893803 | U72: =L72/(F72+G72) -> 5.3923174227787607
B73: XSLT | C73: 23 | D73: 8 | E73: 7 | F73: 14 | G73: 8 | H73: =$F73/$G73 -> 1.75 | I73: =$D73*(LOG10($D73)/LOG10(2))+$E73*(LOG10($E73)/LOG10(2)) -> 43.651484454403231 | J73: =$F73+$G73 -> 22 | K73: =ROUND(100*(MAX(ROUNDUP($I73,0),$J73)-MIN(ROUNDUP($I73,0),$J73))/MAX(ROUNDUP($I73,0),$J73),0) -> 50 | L73: =($F73+$G73)*LOG10($D73+$E73)/LOG10(2) -> 85.95159310338741 | M73: =2*$E73/($D73*$G73) -> 0.21875 | N73: =8/$L73 -> 9.3075645385387443E-2 | O73: =1/$N73 -> 10.743949137923426 | P73: =$M73*$L73 -> 18.801910991365997 | Q73: =8*$N73 -> 0.74460516308309954 | R73: =ROUNDUP($L73/$N73,0) -> 924 | S73: =$R73/$O73 -> 86.001896336098 | T73: =$L73/300 -> 0.28650531034462468 | U73: =L73/(F73+G73) -> 3.9068905956085187
A74: 25 | B74: Prolog | C74: 9 | D74: 11 | E74: 19 | F74: 49 | G74: 30 | H74: =$F74/$G74 -> 1.6333333333333333 | I74: =$D74*(LOG10($D74)/LOG10(2))+$E74*(LOG10($E74)/LOG10(2)) -> 118.76437056043839 | J74: =$F74+$G74 -> 79 | K74: =ROUND(100*(MAX(ROUNDUP($I74,0),$J74)-MIN(ROUNDUP($I74,0),$J74))/MAX(ROUNDUP($I74,0),$J74),0) -> 34 | L74: =($F74+$G74)*LOG10($D74+$E74)/LOG10(2) -> 387.64435705307295 | M74: =2*$E74/($D74*$G74) -> 0.11515151515151516 | N74: =8/$L74 -> 2.0637473123089237E-2 | O74: =1/$N74 -> 48.455544631634112 | P74: =$M74*$L74 -> 44.63783505459628 | Q74: =8*$N74 -> 0.16509978498471389 | R74: =ROUNDUP($L74/$N74,0) -> 18784 | S74: =$R74/$O74 -> 387.65429514410823 | T74: =$L74/300 -> 1.2921478568435765 | U74: =L74/(F74+G74) -> 4.9068905956085187
B75: XSLT | C75: 24 | D75: 7 | E75: 11 | F75: 15 | G75: 16 | H75: =$F75/$G75 -> 0.9375 | I75: =$D75*(LOG10($D75)/LOG10(2))+$E75*(LOG10($E75)/LOG10(2)) -> 57.705232259413506 | J75: =$F75+$G75 -> 31 | K75: =ROUND(100*(MAX(ROUNDUP($I75,0),$J75)-MIN(ROUNDUP($I75,0),$J75))/MAX(ROUNDUP($I75,0),$J75),0) -> 47 | L75: =($F75+$G75)*LOG10($D75+$E75)/LOG10(2) -> 129.26767504471167 | M75: =2*$E75/($D75*$G75) -> 0.19642857142857142 | N75: =8/$L75 -> 6.1887088146614574E-2 | O75: =1/$N75 -> 16.158459380588958 | P75: =$M75*$L75 -> 25.391864740925506 | Q75: =8*$N75 -> 0.4950967051729166 | R75: =ROUNDUP($L75/$N75,0) -> 2089 | S75: =$R75/$O75 -> 129.28212713827784 | T75: =$L75/300 -> 0.43089225014903887 | U75: =L75/(F75+G75) -> 4.1699250014423122
A76: 26 | B76: Prolog | C76: 17 | D76: 20 | E76: 23 | F76: 79 | G76: 44 | H76: =$F76/$G76 -> 1.7954545454545454 | I76: =$D76*(LOG10($D76)/LOG10(2))+$E76*(LOG10($E76)/LOG10(2)) -> 190.48048688705853 | J76: =$F76+$G76 -> 123 | K76: =ROUND(100*(MAX(ROUNDUP($I76,0),$J76)-MIN(ROUNDUP($I76,0),$J76))/MAX(ROUNDUP($I76,0),$J76),0) -> 36 | L76: =($F76+$G76)*LOG10($D76+$E76)/LOG10(2) -> 667.430564828358 | M76: =2*$E76/($D76*$G76) -> 5.2272727272727269E-2 | N76: =8/$L76 -> 1.1986265570647558E-2 | O76: =1/$N76 -> 83.42882060354475 | P76: =$M76*$L76 -> 34.888415888755077 | Q76: =8*$N76 -> 9.5890124565180465E-2 | R76: =ROUNDUP($L76/$N76,0) -> 55683 | S76: =$R76/$O76 -> 667.43122577036797 | T76: =$L76/300 -> 2.2247685494278602 | U76: =L76/(F76+G76) -> 5.4262647547020979
B77: Prolog2 | C77: 14 | D77: 16 | E77: 18 | F77: 61 | G77: 35 | H77: =$F77/$G77 -> 1.7428571428571429 | I77: =$D77*(LOG10($D77)/LOG10(2))+$E77*(LOG10($E77)/LOG10(2)) -> 139.05865002596161 | J77: =$F77+$G77 -> 96 | K77: =ROUND(100*(MAX(ROUNDUP($I77,0),$J77)-MIN(ROUNDUP($I77,0),$J77))/MAX(ROUNDUP($I77,0),$J77),0) -> 31 | L77: =($F77+$G77)*LOG10($D77+$E77)/LOG10(2) -> 488.39643276003255 | M77: =2*$E77/($D77*$G77) -> 6.4285714285714279E-2 | N77: =8/$L77 -> 1.6380136019401886E-2 | O77: =1/$N77 -> 61.049554095004062 | P77: =$M77*$L77 -> 31.396913534573518 | Q77: =8*$N77 -> 0.13104108815521509 | R77: =ROUNDUP($L77/$N77,0) -> 29817 | S77: =$R77/$O77 -> 488.40651569050607 | T77: =$L77/300 -> 1.6279881092001085 | U77: =L77/(F77+G77) -> 5.0874628412503391
B78: Prolog3 | C78: 14 | D78: 18 | E78: 22 | F78: 65 | G78: 37 | H78: =$F78/$G78 -> 1.7567567567567568 | I78: =$D78*(LOG10($D78)/LOG10(2))+$E78*(LOG10($E78)/LOG10(2)) -> 173.16614563598216 | J78: =$F78+$G78 -> 102 | K78: =ROUND(100*(MAX(ROUNDUP($I78,0),$J78)-MIN(ROUNDUP($I78,0),$J78))/MAX(ROUNDUP($I78,0),$J78),0) -> 41 | L78: =($F78+$G78)*LOG10($D78+$E78)/LOG10(2) -> 542.83666567851094 | M78: =2*$E78/($D78*$G78) -> 6.6066066066066062E-2 | N78: =8/$L78 -> 1.4737398016400595E-2 | O78: =1/$N78 -> 67.854583209813867 | P78: =$M78*$L78 -> 35.863083017799518 | Q78: =8*$N78 -> 0.11789918413120476 | R78: =ROUNDUP($L78/$N78,0) -> 36834 | S78: =$R78/$O78 -> 542.83731853609947 | T78: =$L78/300 -> 1.8094555522617031 | U78: =L78/(F78+G78) -> 5.3219280948873617
B79: XSLT | C79: 9 | D79: 5 | E79: 6 | F79: 5 | G79: 6 | H79: =$F79/$G79 -> 0.83333333333333337 | I79: =$D79*(LOG10($D79)/LOG10(2))+$E79*(LOG10($E79)/LOG10(2)) -> 27.119415478763749 | J79: =$F79+$G79 -> 11 | K79: =ROUND(100*(MAX(ROUNDUP($I79,0),$J79)-MIN(ROUNDUP($I79,0),$J79))/MAX(ROUNDUP($I79,0),$J79),0) -> 61 | L79: =($F79+$G79)*LOG10($D79+$E79)/LOG10(2) -> 38.053747805010275 | M79: =2*$E79/($D79*$G79) -> 0.4 | N79: =8/$L79 -> 0.21022896459482751 | O79: =1/$N79 -> 4.7567184756262844 | P79: =$M79*$L79 -> 15.221499122004111 | Q79: =8*$N79 -> 1.6818317167586201 | R79: =ROUNDUP($L79/$N79,0) -> 182 | S79: =$R79/$O79 -> 38.261671556258605 | T79: =$L79/300 -> 0.12684582601670091 | U79: =L79/(F79+G79) -> 3.4594316186372978
A80: 27 | B80: Prolog | C80: 17 | D80: 16 | E80: 21 | F80: 94 | G80: 50 | H80: =$F80/$G80 -> 1.88 | I80: =$D80*(LOG10($D80)/LOG10(2))+$E80*(LOG10($E80)/LOG10(2)) -> 156.23866587835397 | J80: =$F80+$G80 -> 144 | K80: =ROUND(100*(MAX(ROUNDUP($I80,0),$J80)-MIN(ROUNDUP($I80,0),$J80))/MAX(ROUNDUP($I80,0),$J80),0) -> 8 | L80: =($F80+$G80)*LOG10($D80+$E80)/LOG10(2) -> 750.16128465056875 | M80: =2*$E80/($D80*$G80) -> 5.2499999999999998E-2 | N80: =8/$L80 -> 1.0664373333697786E-2 | O80: =1/$N80 -> 93.770160581321093 | P80: =$M80*$L80 -> 39.38346744415486 | Q80: =8*$N80 -> 8.5314986669582288E-2 | R80: =ROUNDUP($L80/$N80,0) -> 70343 | S80: =$R80/$O80 -> 750.16401341230335 | T80: =$L80/300 -> 2.5005376155018957 | U80: =L80/(F80+G80) -> 5.2094533656289492
B81: Prolog2 | C81: 22 | D81: 21 | E81: 28 | F81: 122 | G81: 64 | H81: =$F81/$G81 -> 1.90625 | I81: =$D81*(LOG10($D81)/LOG10(2))+$E81*(LOG10($E81)/LOG10(2)) -> 226.84460369596687 | J81: =$F81+$G81 -> 186 | K81: =ROUND(100*(MAX(ROUNDUP($I81,0),$J81)-MIN(ROUNDUP($I81,0),$J81))/MAX(ROUNDUP($I81,0),$J81),0) -> 18 | L81: =($F81+$G81)*LOG10($D81+$E81)/LOG10(2) -> 1044.3360310054288 | M81: =2*$E81/($D81*$G81) -> 4.1666666666666664E-2 | N81: =8/$L81 -> 7.6603696152262825E-3 | O81: =1/$N81 -> 130.5420038756786 | P81: =$M81*$L81 -> 43.514001291892868 | Q81: =8*$N81 -> 6.128295692181026E-2 | R81: =ROUNDUP($L81/$N81,0) -> 136330 | S81: =$R81/$O81 -> 1044.3381896437991 | T81: =$L81/300 -> 3.4811201033514294 | U81: =L81/(F81+G81) -> 5.6147098441152083
B82: XSLT | C82: 21 | D82: 9 | E82: 8 | F82: 12 | G82: 9 | H82: =$F82/$G82 -> 1.3333333333333333 | I82: =$D82*(LOG10($D82)/LOG10(2))+$E82*(LOG10($E82)/LOG10(2)) -> 52.529325012980806 | J82: =$F82+$G82 -> 21 | K82: =ROUND(100*(MAX(ROUNDUP($I82,0),$J82)-MIN(ROUNDUP($I82,0),$J82))/MAX(ROUNDUP($I82,0),$J82),0) -> 60 | L82: =($F82+$G82)*LOG10($D82+$E82)/LOG10(2) -> 85.836719666257125 | M82: =2*$E82/($D82*$G82) -> 0.19753086419753085 | N82: =8/$L82 -> 9.320020652122897E-2 | O82: =1/$N82 -> 10.729589958282141 | P82: =$M82*$L82 -> 16.955401415556963 | Q82: =8*$N82 -> 0.74560165216983176 | R82: =ROUNDUP($L82/$N82,0) -> 921 | S82: =$R82/$O82 -> 85.837390206051879 | T82: =$L82/300 -> 0.28612239888752372 | U82: =L82/(F82+G82) -> 4.0874628412503391
A83: 28 | B83: Prolog | C83: 16 | D83: 19 | E83: 24 | F83: 79 | G83: 44 | H83: =$F83/$G83 -> 1.7954545454545454 | I83: =$D83*(LOG10($D83)/LOG10(2))+$E83*(LOG10($E83)/LOG10(2)) -> 190.74972277273588 | J83: =$F83+$G83 -> 123 | K83: =ROUND(100*(MAX(ROUNDUP($I83,0),$J83)-MIN(ROUNDUP($I83,0),$J83))/MAX(ROUNDUP($I83,0),$J83),0) -> 36 | L83: =($F83+$G83)*LOG10($D83+$E83)/LOG10(2) -> 667.430564828358 | M83: =2*$E83/($D83*$G83) -> 5.7416267942583733E-2 | N83: =8/$L83 -> 1.1986265570647558E-2 | O83: =1/$N83 -> 83.42882060354475 | P83: =$M83*$L83 -> 38.321372143255005 | Q83: =8*$N83 -> 9.5890124565180465E-2 | R83: =ROUNDUP($L83/$N83,0) -> 55683 | S83: =$R83/$O83 -> 667.43122577036797 | T83: =$L83/300 -> 2.2247685494278602 | U83: =L83/(F83+G83) -> 5.4262647547020979
B84: Prolog2 | C84: 18 | D84: 21 | E84: 28 | F84: 92 | G84: 50 | H84: =$F84/$G84 -> 1.84 | I84: =$D84*(LOG10($D84)/LOG10(2))+$E84*(LOG10($E84)/LOG10(2)) -> 226.84460369596687 | J84: =$F84+$G84 -> 142 | K84: =ROUND(100*(MAX(ROUNDUP($I84,0),$J84)-MIN(ROUNDUP($I84,0),$J84))/MAX(ROUNDUP($I84,0),$J84),0) -> 37 | L84: =($F84+$G84)*LOG10($D84+$E84)/LOG10(2) -> 797.28879786435959 | M84: =2*$E84/($D84*$G84) -> 5.3333333333333337E-2 | N84: =8/$L84 -> 1.0034005270648511E-2 | O84: =1/$N84 -> 99.661099733044964 | P84: =$M84*$L84 -> 42.522069219432517 | Q84: =8*$N84 -> 8.0272042165188087E-2 | R84: =ROUNDUP($L84/$N84,0) -> 79459 | S84: =$R84/$O84 -> 797.29202480046001 | T84: =$L84/300 -> 2.6576293262145319 | U84: =L84/(F84+G84) -> 5.6147098441152083
B85: XSLT | C85: 15 | D85: 7 | E85: 8 | F85: 8 | G85: 8 | H85: =$F85/$G85 -> 1 | I85: =$D85*(LOG10($D85)/LOG10(2))+$E85*(LOG10($E85)/LOG10(2)) -> 43.651484454403231 | J85: =$F85+$G85 -> 16 | K85: =ROUND(100*(MAX(ROUNDUP($I85,0),$J85)-MIN(ROUNDUP($I85,0),$J85))/MAX(ROUNDUP($I85,0),$J85),0) -> 64 | L85: =($F85+$G85)*LOG10($D85+$E85)/LOG10(2) -> 62.510249529736299 | M85: =2*$E85/($D85*$G85) -> 0.2857142857142857 | N85: =8/$L85 -> 0.12797901240490775 | O85: =1/$N85 -> 7.8137811912170365 | P85: =$M85*$L85 -> 17.860071294210371 | Q85: =8*$N85 -> 1.023832099239262 | R85: =ROUNDUP($L85/$N85,0) -> 489 | S85: =$R85/$O85 -> 62.581737065999889 | T85: =$L85/300 -> 0.20836749843245433 | U85: =L85/(F85+G85) -> 3.9068905956085187
A86: 29 | B86: Prolog | C86: 23 | D86: 21 | E86: 34 | F86: 156 | G86: 78 | H86: =$F86/$G86 -> 2 | I86: =$D86*(LOG10($D86)/LOG10(2))+$E86*(LOG10($E86)/LOG10(2)) -> 265.21240248086553 | J86: =$F86+$G86 -> 234 | K86: =ROUND(100*(MAX(ROUNDUP($I86,0),$J86)-MIN(ROUNDUP($I86,0),$J86))/MAX(ROUNDUP($I86,0),$J86),0) -> 12 | L86: =($F86+$G86)*LOG10($D86+$E86)/LOG10(2) -> 1352.8381729647704 | M86: =2*$E86/($D86*$G86) -> 4.1514041514041512E-2 | N86: =8/$L86 -> 5.9134936904299863E-3 | O86: =1/$N86 -> 169.1047716205963 | P86: =$M86*$L86 -> 56.161780074239552 | Q86: =8*$N86 -> 4.7307949523439891E-2 | R86: =ROUNDUP($L86/$N86,0) -> 228772 | S86: =$R86/$O86 -> 1352.8417785470488 | T86: =$L86/300 -> 4.5094605765492348 | U86: =L86/(F86+G86) -> 5.7813597135246599
B87: XSLT | C87: 21 | D87: 9 | E87: 6 | F87: 12 | G87: 6 | H87: =$F87/$G87 -> 2 | I87: =$D87*(LOG10($D87)/LOG10(2))+$E87*(LOG10($E87)/LOG10(2)) -> 44.039100017307746 | J87: =$F87+$G87 -> 18 | K87: =ROUND(100*(MAX(ROUNDUP($I87,0),$J87)-MIN(ROUNDUP($I87,0),$J87))/MAX(ROUNDUP($I87,0),$J87),0) -> 60 | L87: =($F87+$G87)*LOG10($D87+$E87)/LOG10(2) -> 70.324030720953346 | M87: =2*$E87/($D87*$G87) -> 0.22222222222222221 | N87: =8/$L87 -> 0.11375912213769575 | O87: =1/$N87 -> 8.7905038401191682 | P87: =$M87*$L87 -> 15.627562382434077 | Q87: =8*$N87 -> 0.91007297710156598 | R87: =ROUNDUP($L87/$N87,0) -> 619 | S87: =$R87/$O87 -> 70.416896603233667 | T87: =$L87/300 -> 0.23441343573651116 | U87: =L87/(F87+G87) -> 3.9068905956085191
A88: 30 | B88: Prolog | C88: 19 | D88: 22 | E88: 25 | F88: 105 | G88: 53 | H88: =$F88/$G88 -> 1.9811320754716981 | I88: =$D88*(LOG10($D88)/LOG10(2))+$E88*(LOG10($E88)/LOG10(2)) -> 214.20390035438868 | J88: =$F88+$G88 -> 158 | K88: =ROUND(100*(MAX(ROUNDUP($I88,0),$J88)-MIN(ROUNDUP($I88,0),$J88))/MAX(ROUNDUP($I88,0),$J88),0) -> 27 | L88: =($F88+$G88)*LOG10($D88+$E88)/LOG10(2) -> 877.6250385650668 | M88: =2*$E88/($D88*$G88) -> 4.2881646655231559E-2 | N88: =8/$L88 -> 9.1155102104654492E-3 | O88: =1/$N88 -> 109.70312982063335 | P88: =$M88*$L88 -> 37.634006799531164 | Q88: =8*$N88 -> 7.2924081683723593E-2 | R88: =ROUNDUP($L88/$N88,0) -> 96279 | S88: =$R88/$O88 -> 877.63220755340296 | T88: =$L88/300 -> 2.9254167952168895 | U88: =L88/(F88+G88) -> 5.5545888516776376
B89: Prolog2 | C89: 13 | D89: 18 | E89: 20 | F89: 68 | G89: 37 | H89: =$F89/$G89 -> 1.8378378378378379 | I89: =$D89*(LOG10($D89)/LOG10(2))+$E89*(LOG10($E89)/LOG10(2)) -> 161.49721192370885 | J89: =$F89+$G89 -> 105 | K89: =ROUND(100*(MAX(ROUNDUP($I89,0),$J89)-MIN(ROUNDUP($I89,0),$J89))/MAX(ROUNDUP($I89,0),$J89),0) -> 35 | L89: =($F89+$G89)*LOG10($D89+$E89)/LOG10(2) -> 551.03238891157639 | M89: =2*$E89/($D89*$G89) -> 6.006006006006006E-2 | N89: =8/$L89 -> 1.4518202851563689E-2 | O89: =1/$N89 -> 68.879048613947049 | P89: =$M89*$L89 -> 33.095038373067652 | Q89: =8*$N89 -> 0.11614562281250951 | R89: =ROUNDUP($L89/$N89,0) -> 37955 | S89: =$R89/$O89 -> 551.03838923109981 | T89: =$L89/300 -> 1.8367746297052547 | U89: =L89/(F89+G89) -> 5.2479275134435843
B90: XSLT | C90: 15 | D90: 8 | E90: 7 | F90: 8 | G90: 7 | H90: =$F90/$G90 -> 1.1428571428571428 | I90: =$D90*(LOG10($D90)/LOG10(2))+$E90*(LOG10($E90)/LOG10(2)) -> 43.651484454403231 | J90: =$F90+$G90 -> 15 | K90: =ROUND(100*(MAX(ROUNDUP($I90,0),$J90)-MIN(ROUNDUP($I90,0),$J90))/MAX(ROUNDUP($I90,0),$J90),0) -> 66 | L90: =($F90+$G90)*LOG10($D90+$E90)/LOG10(2) -> 58.603358934127783 | M90: =2*$E90/($D90*$G90) -> 0.25 | N90: =8/$L90 -> 0.13651094656523491 | O90: =1/$N90 -> 7.3254198667659729 | P90: =$M90*$L90 -> 14.650839733531946 | Q90: =8*$N90 -> 1.0920875725218793 | R90: =ROUNDUP($L90/$N90,0) -> 430 | S90: =$R90/$O90 -> 58.699707023051012 | T90: =$L90/300 -> 0.19534452978042594 | U90: =L90/(F90+G90) -> 3.9068905956085187
A91: 31 | B91: Prolog | C91: 24 | D91: 23 | E91: 36 | F91: 159 | G91: 85 | H91: =$F91/$G91 -> 1.8705882352941177 | I91: =$D91*(LOG10($D91)/LOG10(2))+$E91*(LOG10($E91)/LOG10(2)) -> 290.15922504123455 | J91: =$F91+$G91 -> 244 | K91: =ROUND(100*(MAX(ROUNDUP($I91,0),$J91)-MIN(ROUNDUP($I91,0),$J91))/MAX(ROUNDUP($I91,0),$J91),0) -> 16 | L91: =($F91+$G91)*LOG10($D91+$E91)/LOG10(2) -> 1435.3649040442892 | M91: =2*$E91/($D91*$G91) -> 3.6828644501278769E-2 | N91: =8/$L91 -> 5.5734956159643944E-3 | O91: =1/$N91 -> 179.42061300553615 | P91: =$M91*$L91 -> 52.862543780659237 | Q91: =8*$N91 -> 4.4587964927715155E-2 | R91: =ROUNDUP($L91/$N91,0) -> 257535 | S91: =$R91/$O91 -> 1435.3701934573903 | T91: =$L91/300 -> 4.7845496801476308 | U91: =L91/(F91+G91) -> 5.8826430493618407
B92: XSLT | C92: 21 | D92: 9 | E92: 8 | F92: 12 | G92: 8 | H92: =$F92/$G92 -> 1.5 | I92: =$D92*(LOG10($D92)/LOG10(2))+$E92*(LOG10($E92)/LOG10(2)) -> 52.529325012980806 | J92: =$F92+$G92 -> 20 | K92: =ROUND(100*(MAX(ROUNDUP($I92,0),$J92)-MIN(ROUNDUP($I92,0),$J92))/MAX(ROUNDUP($I92,0),$J92),0) -> 62 | L92: =($F92+$G92)*LOG10($D92+$E92)/LOG10(2) -> 81.749256825006782 | M92: =2*$E92/($D92*$G92) -> 0.22222222222222221 | N92: =8/$L92 -> 9.7860216847290418E-2 | O92: =1/$N92 -> 10.218657103125848 | P92: =$M92*$L92 -> 18.166501516668173 | Q92: =8*$N92 -> 0.78288173477832335 | R92: =ROUNDUP($L92/$N92,0) -> 836 | S92: =$R92/$O92 -> 81.811141284334795 | T92: =$L92/300 -> 0.27249752275002259 | U92: =L92/(F92+G92) -> 4.0874628412503391
A93: 32 | B93: Prolog | C93: 23 | D93: 23 | E93: 31 | F93: 123 | G93: 63 | H93: =$F93/$G93 -> 1.9523809523809523 | I93: =$D93*(LOG10($D93)/LOG10(2))+$E93*(LOG10($E93)/LOG10(2)) -> 257.6220106113044 | J93: =$F93+$G93 -> 186 | K93: =ROUND(100*(MAX(ROUNDUP($I93,0),$J93)-MIN(ROUNDUP($I93,0),$J93))/MAX(ROUNDUP($I93,0),$J93),0) -> 28 | L93: =($F93+$G93)*LOG10($D93+$E93)/LOG10(2) -> 1070.4090754024053 | M93: =2*$E93/($D93*$G93) -> 4.2788129744651481E-2 | N93: =8/$L93 -> 7.4737781880189237E-3 | O93: =1/$N93 -> 133.80113442530066 | P93: =$M93*$L93 -> 45.800802398170546 | Q93: =8*$N93 -> 5.979022550415139E-2 | R93: =ROUNDUP($L93/$N93,0) -> 143222 | S93: =$R93/$O93 -> 1070.4094596444463 | T93: =$L93/300 -> 3.5680302513413511 | U93: =L93/(F93+G93) -> 5.7548875021634691
B94: Prolog2 | C94: 16 | D94: 19 | E94: 27 | F94: 86 | G94: 48 | H94: =$F94/$G94 -> 1.7916666666666667 | I94: =$D94*(LOG10($D94)/LOG10(2))+$E94*(LOG10($E94)/LOG10(2)) -> 209.09258531384177 | J94: =$F94+$G94 -> 134 | K94: =ROUND(100*(MAX(ROUNDUP($I94,0),$J94)-MIN(ROUNDUP($I94,0),$J94))/MAX(ROUNDUP($I94,0),$J94),0) -> 36 | L94: =($F94+$G94)*LOG10($D94+$E94)/LOG10(2) -> 740.15730211163975 | M94: =2*$E94/($D94*$G94) -> 5.921052631578947E-2 | N94: =8/$L94 -> 1.0808513240599416E-2 | O94: =1/$N94 -> 92.519662763954969 | P94: =$M94*$L94 -> 43.82510341450498 | Q94: =8*$N94 -> 8.6468105924795327E-2 | R94: =ROUNDUP($L94/$N94,0) -> 68480 | S94: =$R94/$O94 -> 740.16698671624795 | T94: =$L94/300 -> 2.467191007038799 | U94: =L94/(F94+G94) -> 5.5235619560570131
B95: XSLT | C95: 22 | D95: 9 | E95: 11 | F95: 14 | G95: 12 | H95: =$F95/$G95 -> 1.1666666666666667 | I95: =$D95*(LOG10($D95)/LOG10(2))+$E95*(LOG10($E95)/LOG10(2)) -> 66.583072817991081 | J95: =$F95+$G95 -> 26 | K95: =ROUND(100*(MAX(ROUNDUP($I95,0),$J95)-MIN(ROUNDUP($I95,0),$J95))/MAX(ROUNDUP($I95,0),$J95),0) -> 61 | L95: =($F95+$G95)*LOG10($D95+$E95)/LOG10(2) -> 112.37013046707142 | M95: =2*$E95/($D95*$G95) -> 0.20370370370370369 | N95: =8/$L95 -> 7.1193296356848984E-2 | O95: =1/$N95 -> 14.046266308383926 | P95: =$M95*$L95 -> 22.890211761810843 | Q95: =8*$N95 -> 0.56954637085479187 | R95: =ROUNDUP($L95/$N95,0) -> 1579 | S95: =$R95/$O95 -> 112.41421494746454 | T95: =$L95/300 -> 0.37456710155690476 | U95: =L95/(F95+G95) -> 4.3219280948873626
A96: 33 | B96: Prolog | C96: 24 | D96: 22 | E96: 31 | F96: 126 | G96: 68 | H96: =$F96/$G96 -> 1.8529411764705883 | I96: =$D96*(LOG10($D96)/LOG10(2))+$E96*(LOG10($E96)/LOG10(2)) -> 251.68758123201366 | J96: =$F96+$G96 -> 194 | K96: =ROUND(100*(MAX(ROUNDUP($I96,0),$J96)-MIN(ROUNDUP($I96,0),$J96))/MAX(ROUNDUP($I96,0),$J96),0) -> 23 | L96: =($F96+$G96)*LOG10($D96+$E96)/LOG10(2) -> 1111.2165681852607 | M96: =2*$E96/($D96*$G96) -> 4.1443850267379678E-2 | N96: =8/$L96 -> 7.1993167030121614E-3 | O96: =1/$N96 -> 138.90207102315759 | P96: =$M96*$L96 -> 46.053093066501447 | Q96: =8*$N96 -> 5.7594533624097291E-2 | R96: =ROUNDUP($L96/$N96,0) -> 154351 | S96: =$R96/$O96 -> 1111.2217324266301 | T96: =$L96/300 -> 3.7040552272842024 | U96: =L96/(F96+G96) -> 5.7279204545631996
B97: Prolog2 | C97: 17 | D97: 19 | E97: 19 | F97: 89 | G97: 40 | H97: =$F97/$G97 -> 2.2250000000000001 | I97: =$D97*(LOG10($D97)/LOG10(2))+$E97*(LOG10($E97)/LOG10(2)) -> 161.42124551085624 | J97: =$F97+$G97 -> 129 | K97: =ROUND(100*(MAX(ROUNDUP($I97,0),$J97)-MIN(ROUNDUP($I97,0),$J97))/MAX(ROUNDUP($I97,0),$J97),0) -> 20 | L97: =($F97+$G97)*LOG10($D97+$E97)/LOG10(2) -> 676.98264923422255 | M97: =2*$E97/($D97*$G97) -> 0.05 | N97: =8/$L97 -> 1.181714185592393E-2 | O97: =1/$N97 -> 84.622831154277819 | P97: =$M97*$L97 -> 33.849132461711129 | Q97: =8*$N97 -> 9.4537134847391444E-2 | R97: =ROUNDUP($L97/$N97,0) -> 57289 | S97: =$R97/$O97 -> 676.99223978402608 | T97: =$L97/300 -> 2.2566088307807419 | U97: =L97/(F97+G97) -> 5.2479275134435852
B98: XSLT | C98: 26 | D98: 12 | E98: 10 | F98: 16 | G98: 12 | H98: =$F98/$G98 -> 1.3333333333333333 | I98: =$D98*(LOG10($D98)/LOG10(2))+$E98*(LOG10($E98)/LOG10(2)) -> 76.238830957527512 | J98: =$F98+$G98 -> 28 | K98: =ROUND(100*(MAX(ROUNDUP($I98,0),$J98)-MIN(ROUNDUP($I98,0),$J98))/MAX(ROUNDUP($I98,0),$J98),0) -> 64 | L98: =($F98+$G98)*LOG10($D98+$E98)/LOG10(2) -> 124.86408532184431 | M98: =2*$E98/($D98*$G98) -> 0.1388888888888889 | N98: =8/$L98 -> 6.4069664062164411E-2 | O98: =1/$N98 -> 15.608010665230541 | P98: =$M98*$L98 -> 17.342234072478377 | Q98: =8*$N98 -> 0.51255731249731529 | R98: =ROUNDUP($L98/$N98,0) -> 1949 | S98: =$R98/$O98 -> 124.87177525715843 | T98: =$L98/300 -> 0.41621361773948107 | U98: =L98/(F98+G98) -> 4.4594316186372973
A99: 34 | B99: Prolog | C99: 14 | D99: 20 | E99: 24 | F99: 78 | G99: 45 | H99: =$F99/$G99 -> 1.7333333333333334 | I99: =$D99*(LOG10($D99)/LOG10(2))+$E99*(LOG10($E99)/LOG10(2)) -> 196.47766191505499 | J99: =$F99+$G99 -> 123 | K99: =ROUND(100*(MAX(ROUNDUP($I99,0),$J99)-MIN(ROUNDUP($I99,0),$J99))/MAX(ROUNDUP($I99,0),$J99),0) -> 38 | L99: =($F99+$G99)*LOG10($D99+$E99)/LOG10(2) -> 671.5100890923876 | M99: =2*$E99/($D99*$G99) -> 5.3333333333333337E-2 | N99: =8/$L99 -> 1.1913447213894868E-2 | O99: =1/$N99 -> 83.93876113654845 | P99: =$M99*$L99 -> 35.813871418260675 | Q99: =8*$N99 -> 9.5307577711158942E-2 | R99: =ROUNDUP($L99/$N99,0) -> 56366 | S99: =$R99/$O99 -> 671.51336565839813 | T99: =$L99/300 -> 2.2383669636412922 | U99: =L99/(F99+G99) -> 5.4594316186372973
B100: XSLT | C100: 31 | D100: 14 | E100: 11 | F100: 18 | G100: 14 | H100: =$F100/$G100 -> 1.2857142857142858 | I100: =$D100*(LOG10($D100)/LOG10(2))+$E100*(LOG10($E100)/LOG10(2)) -> 91.356716713816724 | J100: =$F100+$G100 -> 32 | K100: =ROUND(100*(MAX(ROUNDUP($I100,0),$J100)-MIN(ROUNDUP($I100,0),$J100))/MAX(ROUNDUP($I100,0),$J100),0) -> 65 | L100: =($F100+$G100)*LOG10($D100+$E100)/LOG10(2) -> 148.60339807279121 | M100: =2*$E100/($D100*$G100) -> 0.11224489795918367 | N100: =8/$L100 -> 5.3834569759174125E-2 | O100: =1/$N100 -> 18.575424759098901 | P100: =$M100*$L100 -> 16.6799732530684 | Q100: =8*$N100 -> 0.430676558073393 | R100: =ROUNDUP($L100/$N100,0) -> 2761 | S100: =$R100/$O100 -> 148.63724710507975 | T100: =$L100/300 -> 0.49534466024263735 | U100: =L100/(F100+G100) -> 4.6438561897747253
A101: 35 | B101: Prolog | C101: 11 | D101: 14 | E101: 17 | F101: 52 | G101: 30 | H101: =$F101/$G101 -> 1.7333333333333334 | I101: =$D101*(LOG10($D101)/LOG10(2))+$E101*(LOG10($E101)/LOG10(2)) -> 122.78983721006222 | J101: =$F101+$G101 -> 82 | K101: =ROUND(100*(MAX(ROUNDUP($I101,0),$J101)-MIN(ROUNDUP($I101,0),$J101))/MAX(ROUNDUP($I101,0),$J101),0) -> 33 | L101: =($F101+$G101)*LOG10($D101+$E101)/LOG10(2) -> 406.24409745172375 | M101: =2*$E101/($D101*$G101) -> 8.0952380952380956E-2 | N101: =8/$L101 -> 1.969259381288779E-2 | O101: =1/$N101 -> 50.780512181465475 | P101: =$M101*$L101 -> 32.886426936568114 | Q101: =8*$N101 -> 0.15754075050310232 | R101: =ROUNDUP($L101/$N101,0) -> 20630 | S101: =$R101/$O101 -> 406.25821035987508 | T101: =$L101/300 -> 1.3541469915057458 | U101: =L101/(F101+G101) -> 4.9541963103868749
B102: Prolog2 | C102: 8 | D102: 10 | E102: 13 | F102: 33 | G102: 22 | H102: =$F102/$G102 -> 1.5 | I102: =$D102*(LOG10($D102)/LOG10(2))+$E102*(LOG10($E102)/LOG10(2)) -> 81.32499728470782 | J102: =$F102+$G102 -> 55 | K102: =ROUND(100*(MAX(ROUNDUP($I102,0),$J102)-MIN(ROUNDUP($I102,0),$J102))/MAX(ROUNDUP($I102,0),$J102),0) -> 33 | L102: =($F102+$G102)*LOG10($D102+$E102)/LOG10(2) -> 248.79590758313569 | M102: =2*$E102/($D102*$G102) -> 0.11818181818181818 | N102: =8/$L102 -> 3.2154869739273277E-2 | O102: =1/$N102 -> 31.099488447891957 | P102: =$M102*$L102 -> 29.403152714370581 | Q102: =8*$N102 -> 0.25723895791418622 | R102: =ROUNDUP($L102/$N102,0) -> 7738 | S102: =$R102/$O102 -> 248.81438204249662 | T102: =$L102/300 -> 0.82931969194378563 | U102: =L102/(F102+G102) -> 4.5235619560570122
B103: XSLT | C103: 14 | D103: 4 | E103: 9 | F103: 9 | G103: 10 | H103: =$F103/$G103 -> 0.9 | I103: =$D103*(LOG10($D103)/LOG10(2))+$E103*(LOG10($E103)/LOG10(2)) -> 36.529325012980806 | J103: =$F103+$G103 -> 19 | K103: =ROUND(100*(MAX(ROUNDUP($I103,0),$J103)-MIN(ROUNDUP($I103,0),$J103))/MAX(ROUNDUP($I103,0),$J103),0) -> 49 | L103: =($F103+$G103)*LOG10($D103+$E103)/LOG10(2) -> 70.308354644680747 | M103: =2*$E103/($D103*$G103) -> 0.45 | N103: =8/$L103 -> 0.11378448607466095 | O103: =1/$N103 -> 8.7885443305850934 | P103: =$M103*$L103 -> 31.638759590106336 | Q103: =8*$N103 -> 0.91027588859728759 | R103: =ROUNDUP($L103/$N103,0) -> 618 | S103: =$R103/$O103 -> 70.318812394140465 | T103: =$L103/300 -> 0.23436118214893584 | U103: =L103/(F103+G103) -> 3.7004397181410922
A104: 36 | B104: Prolog | C104: 20 | D104: 21 | E104: 30 | F104: 121 | G104: 70 | H104: =$F104/$G104 -> 1.7285714285714286 | I104: =$D104*(LOG10($D104)/LOG10(2))+$E104*(LOG10($E104)/LOG10(2)) -> 239.44538374660954 | J104: =$F104+$G104 -> 191 | K104: =ROUND(100*(MAX(ROUNDUP($I104,0),$J104)-MIN(ROUNDUP($I104,0),$J104))/MAX(ROUNDUP($I104,0),$J104),0) -> 20 | L104: =($F104+$G104)*LOG10($D104+$E104)/LOG10(2) -> 1083.4332403165556 | M104: =2*$E104/($D104*$G104) -> 4.0816326530612242E-2 | N104: =8/$L104 -> 7.3839344246652188E-3 | O104: =1/$N104 -> 135.42915503956945 | P104: =$M104*$L104 -> 44.22176491087982 | Q104: =8*$N104 -> 5.907147539732175E-2 | R104: =ROUNDUP($L104/$N104,0) -> 146729 | S104: =$R104/$O104 -> 1083.437314196703 | T104: =$L104/300 -> 3.6114441343885186 | U104: =L104/(F104+G104) -> 5.6724253419714952
B105: XSLT | C105: 28 | D105: 10 | E105: 17 | F105: 20 | G105: 21 | H105: =$F105/$G105 -> 0.95238095238095233 | I105: =$D105*(LOG10($D105)/LOG10(2))+$E105*(LOG10($E105)/LOG10(2)) -> 102.70614925012939 | J105: =$F105+$G105 -> 41 | K105: =ROUND(100*(MAX(ROUNDUP($I105,0),$J105)-MIN(ROUNDUP($I105,0),$J105))/MAX(ROUNDUP($I105,0),$J105),0) -> 60 | L105: =($F105+$G105)*LOG10($D105+$E105)/LOG10(2) -> 194.9503875887022 | M105: =2*$E105/($D105*$G105) -> 0.16190476190476191 | N105: =8/$L105 -> 4.1036081533102925E-2 | O105: =1/$N105 -> 24.368798448587775 | P105: =$M105*$L105 -> 31.563396085789883 | Q105: =8*$N105 -> 0.3282886522648234 | R105: =ROUNDUP($L105/$N105,0) -> 4751 | S105: =$R105/$O105 -> 194.96242336377199 | T105: =$L105/300 -> 0.64983462529567404 | U105: =L105/(F105+G105) -> 4.7548875021634682
A106: 37 | B106: Prolog | C106: 23 | D106: 23 | E106: 30 | F106: 141 | G106: 67 | H106: =$F106/$G106 -> 2.1044776119402986 | I106: =$D106*(LOG10($D106)/LOG10(2))+$E106*(LOG10($E106)/LOG10(2)) -> 251.24864285756686 | J106: =$F106+$G106 -> 208 | K106: =ROUND(100*(MAX(ROUNDUP($I106,0),$J106)-MIN(ROUNDUP($I106,0),$J106))/MAX(ROUNDUP($I106,0),$J106),0) -> 17 | L106: =($F106+$G106)*LOG10($D106+$E106)/LOG10(2) -> 1191.4074545491453 | M106: =2*$E106/($D106*$G106) -> 3.8935756002595717E-2 | N106: =8/$L106 -> 6.7147473095401904E-3 | O106: =1/$N106 -> 148.92593181864316 | P106: =$M106*$L106 -> 46.388349949999167 | Q106: =8*$N106 -> 5.3717978476321523E-2 | R106: =ROUNDUP($L106/$N106,0) -> 177432 | S106: =$R106/$O106 -> 1191.4110446263351 | T106: =$L106/300 -> 3.9713581818304844 | U106: =L106/(F106+G106) -> 5.7279204545631988
B107: Prolog2 | C107: 14 | D107: 20 | E107: 24 | F107: 92 | G107: 47 | H107: =$F107/$G107 -> 1.9574468085106382 | I107: =$D107*(LOG10($D107)/LOG10(2))+$E107*(LOG10($E107)/LOG10(2)) -> 196.47766191505499 | J107: =$F107+$G107 -> 139 | K107: =ROUND(100*(MAX(ROUNDUP($I107,0),$J107)-MIN(ROUNDUP($I107,0),$J107))/MAX(ROUNDUP($I107,0),$J107),0) -> 29 | L107: =($F107+$G107)*LOG10($D107+$E107)/LOG10(2) -> 758.86099499058423 | M107: =2*$E107/($D107*$G107) -> 5.106382978723404E-2 | N107: =8/$L107 -> 1.05421151604969E-2 | O107: =1/$N107 -> 94.857624373823029 | P107: =$M107*$L107 -> 38.750348680370259 | Q107: =8*$N107 -> 8.43369212839752E-2 | R107: =ROUNDUP($L107/$N107,0) -> 71984 | S107: =$R107/$O107 -> 758.86361771320878 | T107: =$L107/300 -> 2.5295366499686143 | U107: =L107/(F107+G107) -> 5.4594316186372964
B108: XSLT | C108: 21 | D108: 8 | E108: 7 | F108: 12 | G108: 7 | H108: =$F108/$G108 -> 1.7142857142857142 | I108: =$D108*(LOG10($D108)/LOG10(2))+$E108*(LOG10($E108)/LOG10(2)) -> 43.651484454403231 | J108: =$F108+$G108 -> 19 | K108: =ROUND(100*(MAX(ROUNDUP($I108,0),$J108)-MIN(ROUNDUP($I108,0),$J108))/MAX(ROUNDUP($I108,0),$J108),0) -> 57 | L108: =($F108+$G108)*LOG10($D108+$E108)/LOG10(2) -> 74.230921316561862 | M108: =2*$E108/($D108*$G108) -> 0.25 | N108: =8/$L108 -> 0.10777179991992229 | O108: =1/$N108 -> 9.2788651645702327 | P108: =$M108*$L108 -> 18.557730329140465 | Q108: =8*$N108 -> 0.86217439935937834 | R108: =ROUNDUP($L108/$N108,0) -> 689 | S108: =$R108/$O108 -> 74.254770144826466 | T108: =$L108/300 -> 0.24743640438853953 | U108: =L108/(F108+G108) -> 3.9068905956085191
A109: 38 | B109: Prolog | C109: 30 | D109: 18 | E109: 39 | F109: 136 | G109: 99 | H109: =$F109/$G109 -> 1.3737373737373737 | I109: =$D109*(LOG10($D109)/LOG10(2))+$E109*(LOG10($E109)/LOG10(2)) -> 281.18933656158924 | J109: =$F109+$G109 -> 235 | K109: =ROUND(100*(MAX(ROUNDUP($I109,0),$J109)-MIN(ROUNDUP($I109,0),$J109))/MAX(ROUNDUP($I109,0),$J109),0) -> 17 | L109: =($F109+$G109)*LOG10($D109+$E109)/LOG10(2) -> 1370.7291533287143 | M109: =2*$E109/($D109*$G109) -> 4.3771043771043773E-2 | N109: =8/$L109 -> 5.8363098067715216E-3 | O109: =1/$N109 -> 171.34114416608929 | P109: =$M109*$L109 -> 59.998245768596924 | Q109: =8*$N109 -> 4.6690478454172173E-2 | R109: =ROUNDUP($L109/$N109,0) -> 234863 | S109: =$R109/$O109 -> 1370.7332301477798 | T109: =$L109/300 -> 4.569097177762381 | U109: =L109/(F109+G109) -> 5.8328900141647422
B110: XSLT | C110: 26 | D110: 5 | E110: 16 | F110: 20 | G110: 18 | H110: =$F110/$G110 -> 1.1111111111111112 | I110: =$D110*(LOG10($D110)/LOG10(2))+$E110*(LOG10($E110)/LOG10(2)) -> 75.609640474436816 | J110: =$F110+$G110 -> 38 | K110: =ROUND(100*(MAX(ROUNDUP($I110,0),$J110)-MIN(ROUNDUP($I110,0),$J110))/MAX(ROUNDUP($I110,0),$J110),0) -> 50 | L110: =($F110+$G110)*LOG10($D110+$E110)/LOG10(2) -> 166.9080620655929 | M110: =2*$E110/($D110*$G110) -> 0.35555555555555557 | N110: =8/$L110 -> 4.7930578673042734E-2 | O110: =1/$N110 -> 20.863507758199113 | P110: =$M110*$L110 -> 59.345088734433034 | Q110: =8*$N110 -> 0.38344462938434187 | R110: =ROUNDUP($L110/$N110,0) -> 3483 | S110: =$R110/$O110 -> 166.94220551820783 | T110: =$L110/300 -> 0.55636020688530963 | U110: =L110/(F110+G110) -> 4.3923174227787607
A111: 39 | B111: Prolog | C111: 24 | D111: 22 | E111: 27 | F111: 118 | G111: 64 | H111: =$F111/$G111 -> 1.84375 | I111: =$D111*(LOG10($D111)/LOG10(2))+$E111*(LOG10($E111)/LOG10(2)) -> 226.48945816843417 | J111: =$F111+$G111 -> 182 | K111: =ROUND(100*(MAX(ROUNDUP($I111,0),$J111)-MIN(ROUNDUP($I111,0),$J111))/MAX(ROUNDUP($I111,0),$J111),0) -> 20 | L111: =($F111+$G111)*LOG10($D111+$E111)/LOG10(2) -> 1021.8771916289679 | M111: =2*$E111/($D111*$G111) -> 3.8352272727272728E-2 | N111: =8/$L111 -> 7.828729386989499E-3 | O111: =1/$N111 -> 127.73464895362098 | P111: =$M111*$L111 -> 39.191312747133715 | Q111: =8*$N111 -> 6.2629835095915992E-2 | R111: =ROUNDUP($L111/$N111,0) -> 130530 | S111: =$R111/$O111 -> 1021.8840468837393 | T111: =$L111/300 -> 3.406257305429893 | U111: =L111/(F111+G111) -> 5.6147098441152083
B112: XSLT | C112: 17 | D112: 8 | E112: 9 | F112: 10 | G112: 9 | H112: =$F112/$G112 -> 1.1111111111111112 | I112: =$D112*(LOG10($D112)/LOG10(2))+$E112*(LOG10($E112)/LOG10(2)) -> 52.529325012980806 | J112: =$F112+$G112 -> 19 | K112: =ROUND(100*(MAX(ROUNDUP($I112,0),$J112)-MIN(ROUNDUP($I112,0),$J112))/MAX(ROUNDUP($I112,0),$J112),0) -> 64 | L112: =($F112+$G112)*LOG10($D112+$E112)/LOG10(2) -> 77.661793983756439 | M112: =2*$E112/($D112*$G112) -> 0.25 | N112: =8/$L112 -> 0.10301075457609518 | O112: =1/$N112 -> 9.7077242479695549 | P112: =$M112*$L112 -> 19.41544849593911 | Q112: =8*$N112 -> 0.82408603660876145 | R112: =ROUNDUP($L112/$N112,0) -> 754 | S112: =$R112/$O112 -> 77.670108950375763 | T112: =$L112/300 -> 0.25887264661252146 | U112: =L112/(F112+G112) -> 4.0874628412503391
A113: 40 | B113: Prolog | C113: 20 | D113: 21 | E113: 31 | F113: 147 | G113: 71 | H113: =$F113/$G113 -> 2.0704225352112675 | I113: =$D113*(LOG10($D113)/LOG10(2))+$E113*(LOG10($E113)/LOG10(2)) -> 245.8187515003471 | J113: =$F113+$G113 -> 218 | K113: =ROUND(100*(MAX(ROUNDUP($I113,0),$J113)-MIN(ROUNDUP($I113,0),$J113))/MAX(ROUNDUP($I113,0),$J113),0) -> 11 | L113: =($F113+$G113)*LOG10($D113+$E113)/LOG10(2) -> 1242.6958585547582 | M113: =2*$E113/($D113*$G113) -> 4.1582830315224681E-2 | N113: =8/$L113 -> 6.4376170121818168E-3 | O113: =1/$N113 -> 155.33698231934477 | P113: =$M113*$L113 -> 51.674811019714959 | Q113: =8*$N113 -> 5.1500936097454535E-2 | R113: =ROUNDUP($L113/$N113,0) -> 193037 | S113: =$R113/$O113 -> 1242.6982751805415 | T113: =$L113/300 -> 4.1423195285158609 | U113: =L113/(F113+G113) -> 5.7004397181410926
B114: XSLT | C114: 29 | D114: 8 | E114: 9 | F114: 18 | G114: 9 | H114: =$F114/$G114 -> 2 | I114: =$D114*(LOG10($D114)/LOG10(2))+$E114*(LOG10($E114)/LOG10(2)) -> 52.529325012980806 | J114: =$F114+$G114 -> 27 | K114: =ROUND(100*(MAX(ROUNDUP($I114,0),$J114)-MIN(ROUNDUP($I114,0),$J114))/MAX(ROUNDUP($I114,0),$J114),0) -> 49 | L114: =($F114+$G114)*LOG10($D114+$E114)/LOG10(2) -> 110.36149671375915 | M114: =2*$E114/($D114*$G114) -> 0.25 | N114: =8/$L114 -> 7.2489049516511431E-2 | O114: =1/$N114 -> 13.795187089219892 | P114: =$M114*$L114 -> 27.590374178439788 | Q114: =8*$N114 -> 0.57991239613209145 | R114: =ROUNDUP($L114/$N114,0) -> 1523 | S114: =$R114/$O114 -> 110.40082241364691 | T114: =$L114/300 -> 0.3678716557125305 | U114: =L114/(F114+G114) -> 4.0874628412503391
A115: 42 | B115: Prolog | C115: 14 | D115: 17 | E115: 18 | F115: 66 | G115: 35 | H115: =$F115/$G115 -> 1.8857142857142857 | I115: =$D115*(LOG10($D115)/LOG10(2))+$E115*(LOG10($E115)/LOG10(2)) -> 144.54551832721739 | J115: =$F115+$G115 -> 101 | K115: =ROUND(100*(MAX(ROUNDUP($I115,0),$J115)-MIN(ROUNDUP($I115,0),$J115))/MAX(ROUNDUP($I115,0),$J115),0) -> 30 | L115: =($F115+$G115)*LOG10($D115+$E115)/LOG10(2) -> 518.05758471144156 | M115: =2*$E115/($D115*$G115) -> 6.0504201680672269E-2 | N115: =8/$L115 -> 1.5442298763864264E-2 | O115: =1/$N115 -> 64.757198088930195 | P115: =$M115*$L115 -> 31.344660587583018 | Q115: =8*$N115 -> 0.12353839011091411 | R115: =ROUNDUP($L115/$N115,0) -> 33548 | S115: =$R115/$O115 -> 518.05823893011836 | T115: =$L115/300 -> 1.7268586157048051 | U115: =L115/(F115+G115) -> 5.1292830169449664
B116: Prolog2 | C116: 14 | D116: 19 | E116: 18 | F116: 67 | G116: 34 | H116: =$F116/$G116 -> 1.9705882352941178 | I116: =$D116*(LOG10($D116)/LOG10(2))+$E116*(LOG10($E116)/LOG10(2)) -> 155.76927278138973 | J116: =$F116+$G116 -> 101 | K116: =ROUND(100*(MAX(ROUNDUP($I116,0),$J116)-MIN(ROUNDUP($I116,0),$J116))/MAX(ROUNDUP($I116,0),$J116),0) -> 35 | L116: =($F116+$G116)*LOG10($D116+$E116)/LOG10(2) -> 526.15478992852388 | M116: =2*$E116/($D116*$G116) -> 5.5727554179566562E-2 | N116: =8/$L116 -> 1.5204651089628528E-2 | O116: =1/$N116 -> 65.769348741065485 | P116: =$M116*$L116 -> 29.321319562580278 | Q116: =8*$N116 -> 0.12163720871702823 | R116: =ROUNDUP($L116/$N116,0) -> 34605 | S116: =$R116/$O116 -> 526.15695095659521 | T116: =$L116/300 -> 1.7538492997617463 | U116: =L116/(F116+G116) -> 5.2094533656289492
B117: XSLT | C117: 9 | D117: 5 | E117: 5 | F117: 5 | G117: 5 | H117: =$F117/$G117 -> 1 | I117: =$D117*(LOG10($D117)/LOG10(2))+$E117*(LOG10($E117)/LOG10(2)) -> 23.219280948873624 | J117: =$F117+$G117 -> 10 | K117: =ROUND(100*(MAX(ROUNDUP($I117,0),$J117)-MIN(ROUNDUP($I117,0),$J117))/MAX(ROUNDUP($I117,0),$J117),0) -> 58 | L117: =($F117+$G117)*LOG10($D117+$E117)/LOG10(2) -> 33.219280948873624 | M117: =2*$E117/($D117*$G117) -> 0.4 | N117: =8/$L117 -> 0.24082399653118494 | O117: =1/$N117 -> 4.1524101186092031 | P117: =$M117*$L117 -> 13.287712379549451 | Q117: =8*$N117 -> 1.9265919722494795 | R117: =ROUNDUP($L117/$N117,0) -> 138 | S117: =$R117/$O117 -> 33.233711521303526 | T117: =$L117/300 -> 0.11073093649624542 | U117: =L117/(F117+G117) -> 3.3219280948873626
A118: 43 | B118: Prolog | C118: 14 | D118: 18 | E118: 27 | F118: 103 | G118: 51 | H118: =$F118/$G118 -> 2.0196078431372548 | I118: =$D118*(LOG10($D118)/LOG10(2))+$E118*(LOG10($E118)/LOG10(2)) -> 203.44061258437526 | J118: =$F118+$G118 -> 154 | K118: =ROUND(100*(MAX(ROUNDUP($I118,0),$J118)-MIN(ROUNDUP($I118,0),$J118))/MAX(ROUNDUP($I118,0),$J118),0) -> 25 | L118: =($F118+$G118)*LOG10($D118+$E118)/LOG10(2) -> 845.7453768347699 | M118: =2*$E118/($D118*$G118) -> 5.8823529411764705E-2 | N118: =8/$L118 -> 9.4591117127240647E-3 | O118: =1/$N118 -> 105.71817210434624 | P118: =$M118*$L118 -> 49.749728049104114 | Q118: =8*$N118 -> 7.5672893701792518E-2 | R118: =ROUNDUP($L118/$N118,0) -> 89411 | S118: =$R118/$O118 -> 845.74863734637142 | T118: =$L118/300 -> 2.8191512561158998 | U118: =L118/(F118+G118) -> 5.4918530963296748
B119: XSLT | C119: 22 | D119: 9 | E119: 8 | F119: 13 | G119: 8 | H119: =$F119/$G119 -> 1.625 | I119: =$D119*(LOG10($D119)/LOG10(2))+$E119*(LOG10($E119)/LOG10(2)) -> 52.529325012980806 | J119: =$F119+$G119 -> 21 | K119: =ROUND(100*(MAX(ROUNDUP($I119,0),$J119)-MIN(ROUNDUP($I119,0),$J119))/MAX(ROUNDUP($I119,0),$J119),0) -> 60 | L119: =($F119+$G119)*LOG10($D119+$E119)/LOG10(2) -> 85.836719666257125 | M119: =2*$E119/($D119*$G119) -> 0.22222222222222221 | N119: =8/$L119 -> 9.320020652122897E-2 | O119: =1/$N119 -> 10.729589958282141 | P119: =$M119*$L119 -> 19.074826592501584 | Q119: =8*$N119 -> 0.74560165216983176 | R119: =ROUNDUP($L119/$N119,0) -> 921 | S119: =$R119/$O119 -> 85.837390206051879 | T119: =$L119/300 -> 0.28612239888752372 | U119: =L119/(F119+G119) -> 4.0874628412503391
A120: 44 | B120: Prolog | C120: 18 | D120: 17 | E120: 21 | F120: 103 | G120: 51 | H120: =$F120/$G120 -> 2.0196078431372548 | I120: =$D120*(LOG10($D120)/LOG10(2))+$E120*(LOG10($E120)/LOG10(2)) -> 161.72553417960972 | J120: =$F120+$G120 -> 154 | K120: =ROUND(100*(MAX(ROUNDUP($I120,0),$J120)-MIN(ROUNDUP($I120,0),$J120))/MAX(ROUNDUP($I120,0),$J120),0) -> 5 | L120: =($F120+$G120)*LOG10($D120+$E120)/LOG10(2) -> 808.18083707031212 | M120: =2*$E120/($D120*$G120) -> 4.8442906574394463E-2 | N120: =8/$L120 -> 9.8987746715206958E-3 | O120: =1/$N120 -> 101.02260463378902 | P120: =$M120*$L120 -> 39.150628785413041 | Q120: =8*$N120 -> 7.9190197372165566E-2 | R120: =ROUNDUP($L120/$N120,0) -> 81645 | S120: =$R120/$O120 -> 808.1854580563072 | T120: =$L120/300 -> 2.6939361235677071 | U120: =L120/(F120+G120) -> 5.2479275134435852
B121: Prolog2 | C121: 18 | D121: 19 | E121: 23 | F121: 102 | G121: 53 | H121: =$F121/$G121 -> 1.9245283018867925 | I121: =$D121*(LOG10($D121)/LOG10(2))+$E121*(LOG10($E121)/LOG10(2)) -> 184.75254774473942 | J121: =$F121+$G121 -> 155 | K121: =ROUND(100*(MAX(ROUNDUP($I121,0),$J121)-MIN(ROUNDUP($I121,0),$J121))/MAX(ROUNDUP($I121,0),$J121),0) -> 16 | L121: =($F121+$G121)*LOG10($D121+$E121)/LOG10(2) -> 835.80920053070793 | M121: =2*$E121/($D121*$G121) -> 4.5680238331678252E-2 | N121: =8/$L121 -> 9.571562498857749E-3 | O121: =1/$N121 -> 104.47615006633849 | P121: =$M121*$L121 -> 38.179963480052201 | Q121: =8*$N121 -> 7.6572499990861992E-2 | R121: =ROUNDUP($L121/$N121,0) -> 87323 | S121: =$R121/$O121 -> 835.81755208775519 | T121: =$L121/300 -> 2.7860306684356932 | U121: =L121/(F121+G121) -> 5.3923174227787607
B122: XSLT | C122: 17 | D122: 5 | E122: 7 | F122: 9 | G122: 8 | H122: =$F122/$G122 -> 1.125 | I122: =$D122*(LOG10($D122)/LOG10(2))+$E122*(LOG10($E122)/LOG10(2)) -> 31.26112492884004 | J122: =$F122+$G122 -> 17 | K122: =ROUND(100*(MAX(ROUNDUP($I122,0),$J122)-MIN(ROUNDUP($I122,0),$J122))/MAX(ROUNDUP($I122,0),$J122),0) -> 47 | L122: =($F122+$G122)*LOG10($D122+$E122)/LOG10(2) -> 60.944362512259659 | M122: =2*$E122/($D122*$G122) -> 0.35 | N122: =8/$L122 -> 0.13126726854170814 | O122: =1/$N122 -> 7.6180453140324582 | P122: =$M122*$L122 -> 21.330526879290879 | Q122: =8*$N122 -> 1.0501381483336651 | R122: =ROUNDUP($L122/$N122,0) -> 465 | S122: =$R122/$O122 -> 61.039279871894287 | T122: =$L122/300 -> 0.20314787504086554 | U122: =L122/(F122+G122) -> 3.5849625007211565
A123: 45 | B123: Prolog | C123: 14 | D123: 18 | E123: 23 | F123: 66 | G123: 37 | H123: =$F123/$G123 -> 1.7837837837837838 | I123: =$D123*(LOG10($D123)/LOG10(2))+$E123*(LOG10($E123)/LOG10(2)) -> 179.10057501527291 | J123: =$F123+$G123 -> 103 | K123: =ROUND(100*(MAX(ROUNDUP($I123,0),$J123)-MIN(ROUNDUP($I123,0),$J123))/MAX(ROUNDUP($I123,0),$J123),0) -> 43 | L123: =($F123+$G123)*LOG10($D123+$E123)/LOG10(2) -> 551.82785647566266 | M123: =2*$E123/($D123*$G123) -> 6.9069069069069067E-2 | N123: =8/$L123 -> 1.4497274659335407E-2 | O123: =1/$N123 -> 68.978482059457832 | P123: =$M123*$L123 -> 38.114236333153876 | Q123: =8*$N123 -> 0.11597819727468325 | R123: =ROUNDUP($L123/$N123,0) -> 38065 | S123: =$R123/$O123 -> 551.83875990760225 | T123: =$L123/300 -> 1.8394261882522089 | U123: =L123/(F123+G123) -> 5.3575520046180838
B124: XSLT | C124: 13 | D124: 5 | E124: 7 | F124: 7 | G124: 7 | H124: =$F124/$G124 -> 1 | I124: =$D124*(LOG10($D124)/LOG10(2))+$E124*(LOG10($E124)/LOG10(2)) -> 31.26112492884004 | J124: =$F124+$G124 -> 14 | K124: =ROUND(100*(MAX(ROUNDUP($I124,0),$J124)-MIN(ROUNDUP($I124,0),$J124))/MAX(ROUNDUP($I124,0),$J124),0) -> 56 | L124: =($F124+$G124)*LOG10($D124+$E124)/LOG10(2) -> 50.189475010096189 | M124: =2*$E124/($D124*$G124) -> 0.4 | N124: =8/$L124 -> 0.15939596894350275 | O124: =1/$N124 -> 6.2736843762620245 | P124: =$M124*$L124 -> 20.075790004038478 | Q124: =8*$N124 -> 1.275167751548022 | R124: =ROUNDUP($L124/$N124,0) -> 315 | S124: =$R124/$O124 -> 50.209730217203365 | T124: =$L124/300 -> 0.16729825003365395 | U124: =L124/(F124+G124) -> 3.5849625007211565
A125: 46 | B125: Prolog | C125: 14 | D125: 14 | E125: 20 | F125: 99 | G125: 40 | H125: =$F125/$G125 -> 2.4750000000000001 | I125: =$D125*(LOG10($D125)/LOG10(2))+$E125*(LOG10($E125)/LOG10(2)) -> 139.7415308065537 | J125: =$F125+$G125 -> 139 | K125: =ROUND(100*(MAX(ROUNDUP($I125,0),$J125)-MIN(ROUNDUP($I125,0),$J125))/MAX(ROUNDUP($I125,0),$J125),0) -> 1 | L125: =($F125+$G125)*LOG10($D125+$E125)/LOG10(2) -> 707.15733493379719 | M125: =2*$E125/($D125*$G125) -> 7.1428571428571425E-2 | N125: =8/$L125 -> 1.1312899696853099E-2 | O125: =1/$N125 -> 88.394666866724648 | P125: =$M125*$L125 -> 50.511238209556936 | Q125: =8*$N125 -> 9.0503197574824792E-2 | R125: =ROUNDUP($L125/$N125,0) -> 62509 | S125: =$R125/$O125 -> 707.15804715059039 | T125: =$L125/300 -> 2.3571911164459904 | U125: =L125/(F125+G125) -> 5.0874628412503391
B126: Prolog2 | C126: 21 | D126: 19 | E126: 26 | F126: 106 | G126: 58 | H126: =$F126/$G126 -> 1.8275862068965518 | I126: =$D126*(LOG10($D126)/LOG10(2))+$E126*(LOG10($E126)/LOG10(2)) -> 202.9220554270965 | J126: =$F126+$G126 -> 164 | K126: =ROUND(100*(MAX(ROUNDUP($I126,0),$J126)-MIN(ROUNDUP($I126,0),$J126))/MAX(ROUNDUP($I126,0),$J126),0) -> 19 | L126: =($F126+$G126)*LOG10($D126+$E126)/LOG10(2) -> 900.66390779806659 | M126: =2*$E126/($D126*$G126) -> 4.7186932849364795E-2 | N126: =8/$L126 -> 8.8823366082896715E-3 | O126: =1/$N126 -> 112.58298847475832 | P126: =$M126*$L126 -> 42.499567337113852 | Q126: =8*$N126 -> 7.1058692866317372E-2 | R126: =ROUNDUP($L126/$N126,0) -> 101400 | S126: =$R126/$O126 -> 900.66893208057263 | T126: =$L126/300 -> 3.0022130259935551 | U126: =L126/(F126+G126) -> 5.4918530963296739
B127: XSLT | C127: 19 | D127: 7 | E127: 10 | F127: 11 | G127: 10 | H127: =$F127/$G127 -> 1.1 | I127: =$D127*(LOG10($D127)/LOG10(2))+$E127*(LOG10($E127)/LOG10(2)) -> 52.870765403276849 | J127: =$F127+$G127 -> 21 | K127: =ROUND(100*(MAX(ROUNDUP($I127,0),$J127)-MIN(ROUNDUP($I127,0),$J127))/MAX(ROUNDUP($I127,0),$J127),0) -> 60 | L127: =($F127+$G127)*LOG10($D127+$E127)/LOG10(2) -> 85.836719666257125 | M127: =2*$E127/($D127*$G127) -> 0.2857142857142857 | N127: =8/$L127 -> 9.320020652122897E-2 | O127: =1/$N127 -> 10.729589958282141 | P127: =$M127*$L127 -> 24.524777047502035 | Q127: =8*$N127 -> 0.74560165216983176 | R127: =ROUNDUP($L127/$N127,0) -> 921 | S127: =$R127/$O127 -> 85.837390206051879 | T127: =$L127/300 -> 0.28612239888752372 | U127: =L127/(F127+G127) -> 4.0874628412503391
A128: 47 | B128: Prolog | C128: 31 | D128: 21 | E128: 41 | F128: 186 | G128: 103 | H128: =$F128/$G128 -> 1.8058252427184467 | I128: =$D128*(LOG10($D128)/LOG10(2))+$E128*(LOG10($E128)/LOG10(2)) -> 311.89829806769541 | J128: =$F128+$G128 -> 289 | K128: =ROUND(100*(MAX(ROUNDUP($I128,0),$J128)-MIN(ROUNDUP($I128,0),$J128))/MAX(ROUNDUP($I128,0),$J128),0) -> 7 | L128: =($F128+$G128)*LOG10($D128+$E128)/LOG10(2) -> 1720.7627337018071 | M128: =2*$E128/($D128*$G128) -> 3.7910309754969951E-2 | N128: =8/$L128 -> 4.6491011475997763E-3 | O128: =1/$N128 -> 215.09534171272591 | P128: =$M128*$L128 -> 65.234648249444376 | Q128: =8*$N128 -> 3.719280918079821E-2 | R128: =ROUNDUP($L128/$N128,0) -> 370129 | S128: =$R128/$O128 -> 1720.7671586599574 | T128: =$L128/300 -> 5.7358757790060233 | U128: =L128/(F128+G128) -> 5.9541963103868758
B129: XSLT | C129: 36 | D129: 6 | E129: 20 | F129: 28 | G129: 28 | H129: =$F129/$G129 -> 1 | I129: =$D129*(LOG10($D129)/LOG10(2))+$E129*(LOG10($E129)/LOG10(2)) -> 101.94833690207419 | J129: =$F129+$G129 -> 56 | K129: =ROUND(100*(MAX(ROUNDUP($I129,0),$J129)-MIN(ROUNDUP($I129,0),$J129))/MAX(ROUNDUP($I129,0),$J129),0) -> 45 | L129: =($F129+$G129)*LOG10($D129+$E129)/LOG10(2) -> 263.22462421590114 | M129: =2*$E129/($D129*$G129) -> 0.23809523809523808 | N129: =8/$L129 -> 3.0392293364766166E-2 | O129: =1/$N129 -> 32.903078026987643 | P129: =$M129*$L129 -> 62.672529575214554 | Q129: =8*$N129 -> 0.24313834691812933 | R129: =ROUNDUP($L129/$N129,0) -> 8661 | S129: =$R129/$O129 -> 263.22765283223976 | T129: =$L129/300 -> 0.87741541405300383 | U129: =L129/(F129+G129) -> 4.7004397181410917
A130: 48 | B130: Prolog | C130: 13 | D130: 13 | E130: 21 | F130: 52 | G130: 39 | H130: =$F130/$G130 -> 1.3333333333333333 | I130: =$D130*(LOG10($D130)/LOG10(2))+$E130*(LOG10($E130)/LOG10(2)) -> 140.34438221418816 | J130: =$F130+$G130 -> 91 | K130: =ROUND(100*(MAX(ROUNDUP($I130,0),$J130)-MIN(ROUNDUP($I130,0),$J130))/MAX(ROUNDUP($I130,0),$J130),0) -> 35 | L130: =($F130+$G130)*LOG10($D130+$E130)/LOG10(2) -> 462.95911855378085 | M130: =2*$E130/($D130*$G130) -> 8.2840236686390539E-2 | N130: =8/$L130 -> 1.7280143492995396E-2 | O130: =1/$N130 -> 57.869889819222607 | P130: =$M130*$L130 -> 38.351642957117946 | Q130: =8*$N130 -> 0.13824114794396317 | R130: =ROUNDUP($L130/$N130,0) -> 26792 | S130: =$R130/$O130 -> 462.96960446433263 | T130: =$L130/300 -> 1.5431970618459361 | U130: =L130/(F130+G130) -> 5.0874628412503391
B131: XSLT | C131: 10 | D131: 5 | E131: 6 | F131: 5 | G131: 6 | H131: =$F131/$G131 -> 0.83333333333333337 | I131: =$D131*(LOG10($D131)/LOG10(2))+$E131*(LOG10($E131)/LOG10(2)) -> 27.119415478763749 | J131: =$F131+$G131 -> 11 | K131: =ROUND(100*(MAX(ROUNDUP($I131,0),$J131)-MIN(ROUNDUP($I131,0),$J131))/MAX(ROUNDUP($I131,0),$J131),0) -> 61 | L131: =($F131+$G131)*LOG10($D131+$E131)/LOG10(2) -> 38.053747805010275 | M131: =2*$E131/($D131*$G131) -> 0.4 | N131: =8/$L131 -> 0.21022896459482751 | O131: =1/$N131 -> 4.7567184756262844 | P131: =$M131*$L131 -> 15.221499122004111 | Q131: =8*$N131 -> 1.6818317167586201 | R131: =ROUNDUP($L131/$N131,0) -> 182 | S131: =$R131/$O131 -> 38.261671556258605 | T131: =$L131/300 -> 0.12684582601670091 | U131: =L131/(F131+G131) -> 3.4594316186372978
A132: 49 | B132: Prolog | C132: 28 | D132: 23 | E132: 40 | F132: 206 | G132: 110 | H132: =$F132/$G132 -> 1.8727272727272728 | I132: =$D132*(LOG10($D132)/LOG10(2))+$E132*(LOG10($E132)/LOG10(2)) -> 316.9190487848058 | J132: =$F132+$G132 -> 316 | K132: =ROUND(100*(MAX(ROUNDUP($I132,0),$J132)-MIN(ROUNDUP($I132,0),$J132))/MAX(ROUNDUP($I132,0),$J132),0) -> 0 | L132: =($F132+$G132)*LOG10($D132+$E132)/LOG10(2) -> 1888.8204558259738 | M132: =2*$E132/($D132*$G132) -> 3.1620553359683792E-2 | N132: =8/$L132 -> 4.2354475648145344E-3 | O132: =1/$N132 -> 236.10255697824675 | P132: =$M132*$L132 -> 59.72554801030747 | Q132: =8*$N132 -> 3.3883580518516275E-2 | R132: =ROUNDUP($L132/$N132,0) -> 445956 | S132: =$R132/$O132 -> 1888.8232542144303 | T132: =$L132/300 -> 6.296068186086579 | U132: =L132/(F132+G132) -> 5.9772799234999168
B133: XSLT | C133: 30 | D133: 8 | E133: 10 | F133: 18 | G133: 10 | H133: =$F133/$G133 -> 1.8 | I133: =$D133*(LOG10($D133)/LOG10(2))+$E133*(LOG10($E133)/LOG10(2)) -> 57.219280948873624 | J133: =$F133+$G133 -> 28 | K133: =ROUND(100*(MAX(ROUNDUP($I133,0),$J133)-MIN(ROUNDUP($I133,0),$J133))/MAX(ROUNDUP($I133,0),$J133),0) -> 52 | L133: =($F133+$G133)*LOG10($D133+$E133)/LOG10(2) -> 116.75790004038474 | M133: =2*$E133/($D133*$G133) -> 0.25 | N133: =8/$L133 -> 6.8517847590894701E-2 | O133: =1/$N133 -> 14.594737505048093 | P133: =$M133*$L133 -> 29.189475010096185 | Q133: =8*$N133 -> 0.54814278072715761 | R133: =ROUNDUP($L133/$N133,0) -> 1705 | S133: =$R133/$O133 -> 116.82293014247547 | T133: =$L133/300 -> 0.38919300013461577 | U133: =L133/(F133+G133) -> 4.1699250014423122
A134: 50 | B134: Prolog | C134: 25 | D134: 16 | E134: 38 | F134: 146 | G134: 95 | H134: =$F134/$G134 -> 1.5368421052631578 | I134: =$D134*(LOG10($D134)/LOG10(2))+$E134*(LOG10($E134)/LOG10(2)) -> 263.42124551085624 | J134: =$F134+$G134 -> 241 | K134: =ROUND(100*(MAX(ROUNDUP($I134,0),$J134)-MIN(ROUNDUP($I134,0),$J134))/MAX(ROUNDUP($I134,0),$J134),0) -> 9 | L134: =($F134+$G134)*LOG10($D134+$E134)/LOG10(2) -> 1386.927888021396 | M134: =2*$E134/($D134*$G134) -> 0.05 | N134: =8/$L134 -> 5.7681441617075512E-3 | O134: =1/$N134 -> 173.3659860026745 | P134: =$M134*$L134 -> 69.346394401069801 | Q134: =8*$N134 -> 4.614515329366041E-2 | R134: =ROUNDUP($L134/$N134,0) -> 240447 | S134: =$R134/$O134 -> 1386.9329592500956 | T134: =$L134/300 -> 4.62309296007132 | U134: =L134/(F134+G134) -> 5.7548875021634691
B135: XSLT | C135: 43 | D135: 6 | E135: 17 | F135: 31 | G135: 23 | H135: =$F135/$G135 -> 1.3478260869565217 | I135: =$D135*(LOG10($D135)/LOG10(2))+$E135*(LOG10($E135)/LOG10(2)) -> 84.996643305582708 | J135: =$F135+$G135 -> 54 | K135: =ROUND(100*(MAX(ROUNDUP($I135,0),$J135)-MIN(ROUNDUP($I135,0),$J135))/MAX(ROUNDUP($I135,0),$J135),0) -> 36 | L135: =($F135+$G135)*LOG10($D135+$E135)/LOG10(2) -> 244.27234562707869 | M135: =2*$E135/($D135*$G135) -> 0.24637681159420291 | N135: =8/$L135 -> 3.2750330290000552E-2 | O135: =1/$N135 -> 30.53404320338484 | P135: =$M135*$L135 -> 60.183041676236783 | Q135: =8*$N135 -> 0.26200264232000442 | R135: =ROUNDUP($L135/$N135,0) -> 7459 | S135: =$R135/$O135 -> 244.28471363311411 | T135: =$L135/300 -> 0.81424115209026227 | U135: =L135/(F135+G135) -> 4.5235619560570131
A136: 51 | B136: Prolog | C136: 21 | D136: 18 | E136: 31 | F136: 127 | G136: 64 | H136: =$F136/$G136 -> 1.984375 | I136: =$D136*(LOG10($D136)/LOG10(2))+$E136*(LOG10($E136)/LOG10(2)) -> 228.63873564795475 | J136: =$F136+$G136 -> 191 | K136: =ROUND(100*(MAX(ROUNDUP($I136,0),$J136)-MIN(ROUNDUP($I136,0),$J136))/MAX(ROUNDUP($I136,0),$J136),0) -> 17 | L136: =($F136+$G136)*LOG10($D136+$E136)/LOG10(2) -> 1072.4095802260047 | M136: =2*$E136/($D136*$G136) -> 5.3819444444444448E-2 | N136: =8/$L136 -> 7.4598363792255963E-3 | O136: =1/$N136 -> 134.05119752825058 | P136: =$M136*$L136 -> 57.716487824663446 | Q136: =8*$N136 -> 5.967869103380477E-2 | R136: =ROUNDUP($L136/$N136,0) -> 143758 | S136: =$R136/$O136 -> 1072.4111582047133 | T136: =$L136/300 -> 3.574698600753349 | U136: =L136/(F136+G136) -> 5.6147098441152075
B137: XSLT | C137: 25 | D137: 8 | E137: 8 | F137: 14 | G137: 8 | H137: =$F137/$G137 -> 1.75 | I137: =$D137*(LOG10($D137)/LOG10(2))+$E137*(LOG10($E137)/LOG10(2)) -> 48 | J137: =$F137+$G137 -> 22 | K137: =ROUND(100*(MAX(ROUNDUP($I137,0),$J137)-MIN(ROUNDUP($I137,0),$J137))/MAX(ROUNDUP($I137,0),$J137),0) -> 54 | L137: =($F137+$G137)*LOG10($D137+$E137)/LOG10(2) -> 88 | M137: =2*$E137/($D137*$G137) -> 0.25 | N137: =8/$L137 -> 9.0909090909090912E-2 | O137: =1/$N137 -> 11 | P137: =$M137*$L137 -> 22 | Q137: =8*$N137 -> 0.72727272727272729 | R137: =ROUNDUP($L137/$N137,0) -> 968 | S137: =$R137/$O137 -> 88 | T137: =$L137/300 -> 0.29333333333333333 | U137: =L137/(F137+G137) -> 4
A138: 52 | B138: Prolog | C138: 15 | D138: 11 | E138: 29 | F138: 34 | G138: 55 | H138: =$F138/$G138 -> 0.61818181818181817 | I138: =$D138*(LOG10($D138)/LOG10(2))+$E138*(LOG10($E138)/LOG10(2)) -> 178.93519666370986 | J138: =$F138+$G138 -> 89 | K138: =ROUND(100*(MAX(ROUNDUP($I138,0),$J138)-MIN(ROUNDUP($I138,0),$J138))/MAX(ROUNDUP($I138,0),$J138),0) -> 50 | L138: =($F138+$G138)*LOG10($D138+$E138)/LOG10(2) -> 473.6516004449752 | M138: =2*$E138/($D138*$G138) -> 9.5867768595041328E-2 | N138: =8/$L138 -> 1.6890051659245627E-2 | O138: =1/$N138 -> 59.2064500556219 | P138: =$M138*$L138 -> 45.40792202612986 | Q138: =8*$N138 -> 0.13512041327396501 | R138: =ROUNDUP($L138/$N138,0) -> 28044 | S138: =$R138/$O138 -> 473.66460873188436 | T138: =$L138/300 -> 1.5788386681499174 | U138: =L138/(F138+G138) -> 5.3219280948873617
B139: XSLT | C139: 20 | D139: 4 | E139: 8 | F139: 12 | G139: 8 | H139: =$F139/$G139 -> 1.5 | I139: =$D139*(LOG10($D139)/LOG10(2))+$E139*(LOG10($E139)/LOG10(2)) -> 32 | J139: =$F139+$G139 -> 20 | K139: =ROUND(100*(MAX(ROUNDUP($I139,0),$J139)-MIN(ROUNDUP($I139,0),$J139))/MAX(ROUNDUP($I139,0),$J139),0) -> 38 | L139: =($F139+$G139)*LOG10($D139+$E139)/LOG10(2) -> 71.699250014423129 | M139: =2*$E139/($D139*$G139) -> 0.5 | N139: =8/$L139 -> 0.11157717826045192 | O139: =1/$N139 -> 8.9624062518028911 | P139: =$M139*$L139 -> 35.849625007211564 | Q139: =8*$N139 -> 0.89261742608361538 | R139: =ROUNDUP($L139/$N139,0) -> 643 | S139: =$R139/$O139 -> 71.744125621470587 | T139: =$L139/300 -> 0.2389975000480771 | U139: =L139/(F139+G139) -> 3.5849625007211565
A140: 53 | B140: Prolog | C140: 29 | D140: 19 | E140: 43 | F140: 164 | G140: 93 | H140: =$F140/$G140 -> 1.7634408602150538 | I140: =$D140*(LOG10($D140)/LOG10(2))+$E140*(LOG10($E140)/LOG10(2)) -> 314.04000720761832 | J140: =$F140+$G140 -> 257 | K140: =ROUND(100*(MAX(ROUNDUP($I140,0),$J140)-MIN(ROUNDUP($I140,0),$J140))/MAX(ROUNDUP($I140,0),$J140),0) -> 18 | L140: =($F140+$G140)*LOG10($D140+$E140)/LOG10(2) -> 1530.2284517694268 | M140: =2*$E140/($D140*$G140) -> 4.8670062252405208E-2 | N140: =8/$L140 -> 5.2279775550830186E-3 | O140: =1/$N140 -> 191.27855647117832 | P140: =$M140*$L140 -> 74.476314008019642 | Q140: =8*$N140 -> 4.1823820440664149E-2 | R140: =ROUNDUP($L140/$N140,0) -> 292700 | S140: =$R140/$O140 -> 1530.2290303727996 | T140: =$L140/300 -> 5.1007615058980891 | U140: =L140/(F140+G140) -> 5.9541963103868749
B141: XSLT | C141: 29 | D141: 9 | E141: 14 | F141: 19 | G141: 17 | H141: =$F141/$G141 -> 1.1176470588235294 | I141: =$D141*(LOG10($D141)/LOG10(2))+$E141*(LOG10($E141)/LOG10(2)) -> 81.832293921787254 | J141: =$F141+$G141 -> 36 | K141: =ROUND(100*(MAX(ROUNDUP($I141,0),$J141)-MIN(ROUNDUP($I141,0),$J141))/MAX(ROUNDUP($I141,0),$J141),0) -> 56 | L141: =($F141+$G141)*LOG10($D141+$E141)/LOG10(2) -> 162.84823041805245 | M141: =2*$E141/($D141*$G141) -> 0.18300653594771241 | N141: =8/$L141 -> 4.9125495435000839E-2 | O141: =1/$N141 -> 20.356028802256557 | P141: =$M141*$L141 -> 29.802290534022671 | Q141: =8*$N141 -> 0.39300396348000671 | R141: =ROUNDUP($L141/$N141,0) -> 3315 | S141: =$R141/$O141 -> 162.85101736702777 | T141: =$L141/300 -> 0.54282743472684147 | U141: =L141/(F141+G141) -> 4.5235619560570122
A142: 54 | B142: Prolog | C142: 24 | D142: 19 | E142: 41 | F142: 175 | G142: 96 | H142: =$F142/$G142 -> 1.8229166666666667 | I142: =$D142*(LOG10($D142)/LOG10(2))+$E142*(LOG10($E142)/LOG10(2)) -> 300.37025494476956 | J142: =$F142+$G142 -> 271 | K142: =ROUND(100*(MAX(ROUNDUP($I142,0),$J142)-MIN(ROUNDUP($I142,0),$J142))/MAX(ROUNDUP($I142,0),$J142),0) -> 10 | L142: =($F142+$G142)*LOG10($D142+$E142)/LOG10(2) -> 1600.7673514099085 | M142: =2*$E142/($D142*$G142) -> 4.4956140350877194E-2 | N142: =8/$L142 -> 4.9976031763477912E-3 | O142: =1/$N142 -> 200.09591892623857 | P142: =$M142*$L142 -> 71.964321719085802 | Q142: =8*$N142 -> 3.9980825410782329E-2 | R142: =ROUNDUP($L142/$N142,0) -> 320308 | S142: =$R142/$O142 -> 1600.7722782096084 | T142: =$L142/300 -> 5.3358911713663622 | U142: =L142/(F142+G142) -> 5.9068905956085187
B143: Prolog2 | C143: 21 | D143: 17 | E143: 39 | F143: 161 | G143: 88 | H143: =$F143/$G143 -> 1.8295454545454546 | I143: =$D143*(LOG10($D143)/LOG10(2))+$E143*(LOG10($E143)/LOG10(2)) -> 275.61755483688341 | J143: =$F143+$G143 -> 249 | K143: =ROUND(100*(MAX(ROUNDUP($I143,0),$J143)-MIN(ROUNDUP($I143,0),$J143))/MAX(ROUNDUP($I143,0),$J143),0) -> 10 | L143: =($F143+$G143)*LOG10($D143+$E143)/LOG10(2) -> 1446.0313755923435 | M143: =2*$E143/($D143*$G143) -> 5.213903743315508E-2 | N143: =8/$L143 -> 5.5323834150714252E-3 | O143: =1/$N143 -> 180.75392194904293 | P143: =$M143*$L143 -> 75.394684021525933 | Q143: =8*$N143 -> 4.4259067320571402E-2 | R143: =ROUNDUP($L143/$N143,0) -> 261376 | S143: =$R143/$O143 -> 1446.0322474977088 | T143: =$L143/300 -> 4.8201045853078117 | U143: =L143/(F143+G143) -> 5.8073549220576046
B144: XSLT | C144: 29 | D144: 6 | E144: 11 | F144: 18 | G144: 11 | H144: =$F144/$G144 -> 1.6363636363636365 | I144: =$D144*(LOG10($D144)/LOG10(2))+$E144*(LOG10($E144)/LOG10(2)) -> 53.563522809337215 | J144: =$F144+$G144 -> 29 | K144: =ROUND(100*(MAX(ROUNDUP($I144,0),$J144)-MIN(ROUNDUP($I144,0),$J144))/MAX(ROUNDUP($I144,0),$J144),0) -> 46 | L144: =($F144+$G144)*LOG10($D144+$E144)/LOG10(2) -> 118.53642239625984 | M144: =2*$E144/($D144*$G144) -> 0.33333333333333331 | N144: =8/$L144 -> 6.7489804722269259E-2 | O144: =1/$N144 -> 14.817052799532478 | P144: =$M144*$L144 -> 39.512140798753279 | Q144: =8*$N144 -> 0.53991843777815407 | R144: =ROUNDUP($L144/$N144,0) -> 1757 | S144: =$R144/$O144 -> 118.57958689702708 | T144: =$L144/300 -> 0.39512140798753281 | U144: =L144/(F144+G144) -> 4.0874628412503391
A145: 55 | B145: Prolog | C145: 15 | D145: 14 | E145: 23 | F145: 84 | G145: 43 | H145: =$F145/$G145 -> 1.9534883720930232 | I145: =$D145*(LOG10($D145)/LOG10(2))+$E145*(LOG10($E145)/LOG10(2)) -> 157.34489389811773 | J145: =$F145+$G145 -> 127 | K145: =ROUND(100*(MAX(ROUNDUP($I145,0),$J145)-MIN(ROUNDUP($I145,0),$J145))/MAX(ROUNDUP($I145,0),$J145),0) -> 20 | L145: =($F145+$G145)*LOG10($D145+$E145)/LOG10(2) -> 661.60057743487664 | M145: =2*$E145/($D145*$G145) -> 7.6411960132890366E-2 | N145: =8/$L145 -> 1.2091887874428985E-2 | O145: =1/$N145 -> 82.70007217935958 | P145: =$M145*$L145 -> 50.554196946851043 | Q145: =8*$N145 -> 9.6735102995431879E-2 | R145: =ROUNDUP($L145/$N145,0) -> 54715 | S145: =$R145/$O145 -> 661.60764504938197 | T145: =$L145/300 -> 2.2053352581162553 | U145: =L145/(F145+G145) -> 5.2094533656289501
B146: XSLT | C146: 14 | D146: 4 | E146: 6 | F146: 8 | G146: 6 | H146: =$F146/$G146 -> 1.3333333333333333 | I146: =$D146*(LOG10($D146)/LOG10(2))+$E146*(LOG10($E146)/LOG10(2)) -> 23.509775004326936 | J146: =$F146+$G146 -> 14 | K146: =ROUND(100*(MAX(ROUNDUP($I146,0),$J146)-MIN(ROUNDUP($I146,0),$J146))/MAX(ROUNDUP($I146,0),$J146),0) -> 42 | L146: =($F146+$G146)*LOG10($D146+$E146)/LOG10(2) -> 46.506993328423071 | M146: =2*$E146/($D146*$G146) -> 0.5 | N146: =8/$L146 -> 0.17201714037941784 | O146: =1/$N146 -> 5.8133741660528839 | P146: =$M146*$L146 -> 23.253496664211536 | Q146: =8*$N146 -> 1.3761371230353427 | R146: =ROUNDUP($L146/$N146,0) -> 271 | S146: =$R146/$O146 -> 46.616645042822235 | T146: =$L146/300 -> 0.15502331109474357 | U146: =L146/(F146+G146) -> 3.3219280948873622
A147: 56 | B147: Prolog | C147: 50 | D147: 28 | E147: 43 | F147: 302 | G147: 174 | H147: =$F147/$G147 -> 1.735632183908046 | I147: =$D147*(LOG10($D147)/LOG10(2))+$E147*(LOG10($E147)/LOG10(2)) -> 367.93532226980312 | J147: =$F147+$G147 -> 476 | K147: =ROUND(100*(MAX(ROUNDUP($I147,0),$J147)-MIN(ROUNDUP($I147,0),$J147))/MAX(ROUNDUP($I147,0),$J147),0) -> 23 | L147: =($F147+$G147)*LOG10($D147+$E147)/LOG10(2) -> 2927.2796288842287 | M147: =2*$E147/($D147*$G147) -> 1.7651888341543513E-2 | N147: =8/$L147 -> 2.7329128112879688E-3 | O147: =1/$N147 -> 365.90995361052859 | P147: =$M147*$L147 -> 51.672013153539339 | Q147: =8*$N147 -> 2.186330249030375E-2 | R147: =ROUNDUP($L147/$N147,0) -> 1071121 | S147: =$R147/$O147 -> 2927.2803033395808 | T147: =$L147/300 -> 9.7575987629474294 | U147: =L147/(F147+G147) -> 6.1497471195046822
B148: XSLT | C148: 27 | D148: 12 | E148: 15 | F148: 17 | G148: 16 | H148: =$F148/$G148 -> 1.0625 | I148: =$D148*(LOG10($D148)/LOG10(2))+$E148*(LOG10($E148)/LOG10(2)) -> 101.62290894278166 | J148: =$F148+$G148 -> 33 | K148: =ROUND(100*(MAX(ROUNDUP($I148,0),$J148)-MIN(ROUNDUP($I148,0),$J148))/MAX(ROUNDUP($I148,0),$J148),0) -> 68 | L148: =($F148+$G148)*LOG10($D148+$E148)/LOG10(2) -> 156.91128757139447 | M148: =2*$E148/($D148*$G148) -> 0.15625 | N148: =8/$L148 -> 5.0984222510824843E-2 | O148: =1/$N148 -> 19.613910946424308 | P148: =$M148*$L148 -> 24.517388683030386 | Q148: =8*$N148 -> 0.40787378008659875 | R148: =ROUNDUP($L148/$N148,0) -> 3078 | S148: =$R148/$O148 -> 156.92943688831886 | T148: =$L148/300 -> 0.52303762523798158 | U148: =L148/(F148+G148) -> 4.7548875021634691
A149: 63 | B149: Prolog | C149: 14 | D149: 16 | E149: 23 | F149: 91 | G149: 45 | H149: =$F149/$G149 -> 2.0222222222222221 | I149: =$D149*(LOG10($D149)/LOG10(2))+$E149*(LOG10($E149)/LOG10(2)) -> 168.0419249893113 | J149: =$F149+$G149 -> 136 | K149: =ROUND(100*(MAX(ROUNDUP($I149,0),$J149)-MIN(ROUNDUP($I149,0),$J149))/MAX(ROUNDUP($I149,0),$J149),0) -> 20 | L149: =($F149+$G149)*LOG10($D149+$E149)/LOG10(2) -> 718.81470176526568 | M149: =2*$E149/($D149*$G149) -> 6.3888888888888884E-2 | N149: =8/$L149 -> 1.1129432912757063E-2 | O149: =1/$N149 -> 89.85183772065821 | P149: =$M149*$L149 -> 45.924272612780861 | Q149: =8*$N149 -> 8.90354633020565E-2 | R149: =ROUNDUP($L149/$N149,0) -> 64587 | S149: =$R149/$O149 -> 718.81668353624036 | T149: =$L149/300 -> 2.396049005884219 | U149: =L149/(F149+G149) -> 5.2854022188622478
B150: Prolog2 | C150: 12 | D150: 14 | E150: 22 | F150: 69 | G150: 43 | H150: =$F150/$G150 -> 1.6046511627906976 | I150: =$D150*(LOG10($D150)/LOG10(2))+$E150*(LOG10($E150)/LOG10(2)) -> 151.41046451882698 | J150: =$F150+$G150 -> 112 | K150: =ROUND(100*(MAX(ROUNDUP($I150,0),$J150)-MIN(ROUNDUP($I150,0),$J150))/MAX(ROUNDUP($I150,0),$J150),0) -> 26 | L150: =($F150+$G150)*LOG10($D150+$E150)/LOG10(2) -> 579.0316001615389 | M150: =2*$E150/($D150*$G150) -> 7.3089700996677748E-2 | N150: =8/$L150 -> 1.3816171686947916E-2 | O150: =1/$N150 -> 72.378950020192363 | P150: =$M150*$L150 -> 42.321246523434738 | Q150: =8*$N150 -> 0.11052937349558332 | R150: =ROUNDUP($L150/$N150,0) -> 41910 | S150: =$R150/$O150 -> 579.03575539998712 | T150: =$L150/300 -> 1.9301053338717964 | U150: =L150/(F150+G150) -> 5.1699250014423113
B151: XSLT | C151: 23 | D151: 8 | E151: 7 | F151: 14 | G151: 8 | H151: =$F151/$G151 -> 1.75 | I151: =$D151*(LOG10($D151)/LOG10(2))+$E151*(LOG10($E151)/LOG10(2)) -> 43.651484454403231 | J151: =$F151+$G151 -> 22 | K151: =ROUND(100*(MAX(ROUNDUP($I151,0),$J151)-MIN(ROUNDUP($I151,0),$J151))/MAX(ROUNDUP($I151,0),$J151),0) -> 50 | L151: =($F151+$G151)*LOG10($D151+$E151)/LOG10(2) -> 85.95159310338741 | M151: =2*$E151/($D151*$G151) -> 0.21875 | N151: =8/$L151 -> 9.3075645385387443E-2 | O151: =1/$N151 -> 10.743949137923426 | P151: =$M151*$L151 -> 18.801910991365997 | Q151: =8*$N151 -> 0.74460516308309954 | R151: =ROUNDUP($L151/$N151,0) -> 924 | S151: =$R151/$O151 -> 86.001896336098 | T151: =$L151/300 -> 0.28650531034462468 | U151: =L151/(F151+G151) -> 3.9068905956085187
A152: 64 | B152: Prolog | C152: 12 | D152: 15 | E152: 22 | F152: 67 | G152: 38 | H152: =$F152/$G152 -> 1.763157894736842 | I152: =$D152*(LOG10($D152)/LOG10(2))+$E152*(LOG10($E152)/LOG10(2)) -> 156.71085454414833 | J152: =$F152+$G152 -> 105 | K152: =ROUND(100*(MAX(ROUNDUP($I152,0),$J152)-MIN(ROUNDUP($I152,0),$J152))/MAX(ROUNDUP($I152,0),$J152),0) -> 33 | L152: =($F152+$G152)*LOG10($D152+$E152)/LOG10(2) -> 546.99260339103967 | M152: =2*$E152/($D152*$G152) -> 7.7192982456140355E-2 | N152: =8/$L152 -> 1.4625426286214108E-2 | O152: =1/$N152 -> 68.374075423879958 | P152: =$M152*$L152 -> 42.223990437203064 | Q152: =8*$N152 -> 0.11700341028971287 | R152: =ROUNDUP($L152/$N152,0) -> 37401 | S152: =$R152/$O152 -> 547.00556853069384 | T152: =$L152/300 -> 1.8233086779701322 | U152: =L152/(F152+G152) -> 5.2094533656289492
B153: Prolog2 | C153: 15 | D153: 11 | E153: 19 | F153: 69 | G153: 43 | H153: =$F153/$G153 -> 1.6046511627906976 | I153: =$D153*(LOG10($D153)/LOG10(2))+$E153*(LOG10($E153)/LOG10(2)) -> 118.76437056043839 | J153: =$F153+$G153 -> 112 | K153: =ROUND(100*(MAX(ROUNDUP($I153,0),$J153)-MIN(ROUNDUP($I153,0),$J153))/MAX(ROUNDUP($I153,0),$J153),0) -> 6 | L153: =($F153+$G153)*LOG10($D153+$E153)/LOG10(2) -> 549.57174670815402 | M153: =2*$E153/($D153*$G153) -> 8.0338266384778007E-2 | N153: =8/$L153 -> 1.45567890778933E-2 | O153: =1/$N153 -> 68.696468338519253 | P153: =$M153*$L153 -> 44.151641384587421 | Q153: =8*$N153 -> 0.1164543126231464 | R153: =ROUNDUP($L153/$N153,0) -> 37754 | S153: =$R153/$O153 -> 549.57701484678364 | T153: =$L153/300 -> 1.8319058223605134 | U153: =L153/(F153+G153) -> 4.9068905956085178
B154: Prolog3 | C154: 9 | D154: 12 | E154: 19 | F154: 44 | G154: 28 | H154: =$F154/$G154 -> 1.5714285714285714 | I154: =$D154*(LOG10($D154)/LOG10(2))+$E154*(LOG10($E154)/LOG10(2)) -> 123.730172764082 | J154: =$F154+$G154 -> 72 | K154: =ROUND(100*(MAX(ROUNDUP($I154,0),$J154)-MIN(ROUNDUP($I154,0),$J154))/MAX(ROUNDUP($I154,0),$J154),0) -> 42 | L154: =($F154+$G154)*LOG10($D154+$E154)/LOG10(2) -> 356.70213434785501 | M154: =2*$E154/($D154*$G154) -> 0.1130952380952381 | N154: =8/$L154 -> 2.2427676286899983E-2 | O154: =1/$N154 -> 44.587766793481876 | P154: =$M154*$L154 -> 40.341312813150267 | Q154: =8*$N154 -> 0.17942141029519987 | R154: =ROUNDUP($L154/$N154,0) -> 15905 | S154: =$R154/$O154 -> 356.71219134314424 | T154: =$L154/300 -> 1.18900711449285 | U154: =L154/(F154+G154) -> 4.9541963103868749
B155: XSLT | C155: 24 | D155: 7 | E155: 11 | F155: 15 | G155: 16 | H155: =$F155/$G155 -> 0.9375 | I155: =$D155*(LOG10($D155)/LOG10(2))+$E155*(LOG10($E155)/LOG10(2)) -> 57.705232259413506 | J155: =$F155+$G155 -> 31 | K155: =ROUND(100*(MAX(ROUNDUP($I155,0),$J155)-MIN(ROUNDUP($I155,0),$J155))/MAX(ROUNDUP($I155,0),$J155),0) -> 47 | L155: =($F155+$G155)*LOG10($D155+$E155)/LOG10(2) -> 129.26767504471167 | M155: =2*$E155/($D155*$G155) -> 0.19642857142857142 | N155: =8/$L155 -> 6.1887088146614574E-2 | O155: =1/$N155 -> 16.158459380588958 | P155: =$M155*$L155 -> 25.391864740925506 | Q155: =8*$N155 -> 0.4950967051729166 | R155: =ROUNDUP($L155/$N155,0) -> 2089 | S155: =$R155/$O155 -> 129.28212713827784 | T155: =$L155/300 -> 0.43089225014903887 | U155: =L155/(F155+G155) -> 4.1699250014423122
A156: 65 | B156: Prolog | C156: 25 | D156: 22 | E156: 34 | F156: 173 | G156: 81 | H156: =$F156/$G156 -> 2.1358024691358026 | I156: =$D156*(LOG10($D156)/LOG10(2))+$E156*(LOG10($E156)/LOG10(2)) -> 271.08123221253209 | J156: =$F156+$G156 -> 254 | K156: =ROUND(100*(MAX(ROUNDUP($I156,0),$J156)-MIN(ROUNDUP($I156,0),$J156))/MAX(ROUNDUP($I156,0),$J156),0) -> 7 | L156: =($F156+$G156)*LOG10($D156+$E156)/LOG10(2) -> 1475.0681502026316 | M156: =2*$E156/($D156*$G156) -> 3.8159371492704826E-2 | N156: =8/$L156 -> 5.4234782297353729E-3 | O156: =1/$N156 -> 184.38351877532895 | P156: =$M156*$L156 -> 56.287673520639139 | Q156: =8*$N156 -> 4.3387825837882983E-2 | R156: =ROUNDUP($L156/$N156,0) -> 271979 | S156: =$R156/$O156 -> 1475.072185445197 | T156: =$L156/300 -> 4.9168938340087722 | U156: =L156/(F156+G156) -> 5.8073549220576046
B157: Prolog2 | C157: 24 | D157: 21 | E157: 34 | F157: 165 | G157: 81 | H157: =$F157/$G157 -> 2.0370370370370372 | I157: =$D157*(LOG10($D157)/LOG10(2))+$E157*(LOG10($E157)/LOG10(2)) -> 265.21240248086553 | J157: =$F157+$G157 -> 246 | K157: =ROUND(100*(MAX(ROUNDUP($I157,0),$J157)-MIN(ROUNDUP($I157,0),$J157))/MAX(ROUNDUP($I157,0),$J157),0) -> 8 | L157: =($F157+$G157)*LOG10($D157+$E157)/LOG10(2) -> 1422.2144895270662 | M157: =2*$E157/($D157*$G157) -> 3.9976484420928868E-2 | N157: =8/$L157 -> 5.6250305835797432E-3 | O157: =1/$N157 -> 177.77681119088328 | P157: =$M157*$L157 -> 56.855135383798064 | Q157: =8*$N157 -> 4.5000244668637945E-2 | R157: =ROUNDUP($L157/$N157,0) -> 252837 | S157: =$R157/$O157 -> 1422.2158576605516 | T157: =$L157/300 -> 4.7407149650902207 | U157: =L157/(F157+G157) -> 5.781359713524659
B158: XSLT | C158: 30 | D158: 8 | E158: 10 | F158: 18 | G158: 10 | H158: =$F158/$G158 -> 1.8 | I158: =$D158*(LOG10($D158)/LOG10(2))+$E158*(LOG10($E158)/LOG10(2)) -> 57.219280948873624 | J158: =$F158+$G158 -> 28 | K158: =ROUND(100*(MAX(ROUNDUP($I158,0),$J158)-MIN(ROUNDUP($I158,0),$J158))/MAX(ROUNDUP($I158,0),$J158),0) -> 52 | L158: =($F158+$G158)*LOG10($D158+$E158)/LOG10(2) -> 116.75790004038474 | M158: =2*$E158/($D158*$G158) -> 0.25 | N158: =8/$L158 -> 6.8517847590894701E-2 | O158: =1/$N158 -> 14.594737505048093 | P158: =$M158*$L158 -> 29.189475010096185 | Q158: =8*$N158 -> 0.54814278072715761 | R158: =ROUNDUP($L158/$N158,0) -> 1705 | S158: =$R158/$O158 -> 116.82293014247547 | T158: =$L158/300 -> 0.38919300013461577 | U158: =L158/(F158+G158) -> 4.1699250014423122